name,type,headline,gender,created_time,vote,comment,content
吴才泽,people,嵌入式相关,1,2018-05-04 12:27:02,130,37,RISC-V 目前的开源实现还挺不完善的，离商用还有很长一段路，离成功还有更长的路。但是它的价值是肯定的，已经有一些国内公司在实际产品中使用了RV32和RV64的商业核，应用在比较激进/前沿的产品里。因为这些产品（芯片）比较激进，开源的RV很适合来魔改完成这些设计，同时又可以直接使用工具链等现成资源，方便后期的一些开发。RV ISA本身就是弯道超车（后发优势）的结果，很多设计是总结了前人教训的，避开了很多历史包袱，达到了简约而不简单的效果，后期能够发展起来的话在性能上是没有问题的。但是个人感觉开源的东西相对商业的使用门槛可能会高些（类比windows和linux，iphone和安卓?），商业化使用RV有更高的自由度，也对设计公司有更高的要求。所以这就要求中国培养更多的芯片人才，而芯片设计里，后端还是需要license，目前还没有啥开源的后端，所以我们能做的就是培养更多的芯片前端人才。所以，这里打个 广而告之，少年，如果你想成为芯片前端人才，为祖国芯片弯道超车做贡献的话，看这里 看这里，RISC-V开发板，不要Hifive unleashed 的999美金，不要Hifive one的59美金，不用洋人的主芯片，全国产RISC-V开源开发板，国产主芯片+国产开源RISC-V核+国产操作系统+国产板卡，只要9美金！感兴趣的来点个赞吧！6月新鲜出炉！不要急，可以先来q群和大佬们吹吹水:573832310
立党,people,朋克,0,2018-05-04 16:45:04,39,2,要是每个人都想着如何在RISC-V上面给Linux提交代码，移植编译器，移植编译现有的代码和项目，并且号召中国人都来交钱用，或许还有机会；如果每个人都想着骗一比投资，然后继续倚仗着指令集的问题，继续拘泥于电视机顶盒、空调遥控器、路由器、某个钻井设备的一个控制芯片，那就永远没有超车的机会。
匿名用户,people,,1,2018-05-04 13:31:39,15,11,我认为可能性不大：    按照我的理解RISC-V仅仅是一套开源指令集，定义了一系列指令集，内存访问，寄存器等等的规范。但是并不包括如何实现。    CPU的性能受哪些方面影响？从上到下指令集仅是第一部分，而寄存器传输级设计则是第二部分，到了综合这个阶段厂家的工艺库本身可以算是第三部分。但显然RISC-V只能涵盖第一部分，也许会有开源实现来涵盖第二部分。    那么事情就很明显了，所谓弯道超车光靠RISC-V是不行的，如果可以的话，那我们早就超车了，因为RISC-V不是第一个开源指令集。甚至开源参考设计已经有一堆了比如OpenPOWER OpenSPARC等等，也没有见过那家公司这得靠这些设计超了车。要注意，这两个可是开源参考设计，和RISC-V这种指令集级别的开源靠谱多了。    现在一堆人讨论这个，无非就是又一轮概念炒作，期望借这个机会捞一笔走人，和之前的VR，区块链，AI等等没有什么不同。我不是指所有人都在炒作，而是指大部分人都在炒作。    我也不是说RISC-V没有意义，对于有实力的厂商，比如苹果，本来就有芯片设计能力，如果利用RISC-V那么应该能降低不少成本。又或者云服务提供商，也许数据中心里面所有机器都换了自产CPU。还有可能是一些小作坊式公司，靠跟风卖RISC-V开发板也能捞一笔。    所以弯道超车算是一个半伪命题，隐含着小农式的投机心理，就比期望天上掉馅饼好一丁点。    实际上只要资金到位，国产芯片超车是一个很正常的事情。如果不想花钱还想走捷径超车，那只有去做白日梦了。
jialin zhong,people,HLS/FPGA/SDR/比特币,1,2018-05-12 03:46:28,3,1,中国芯片本身就是个伪命题。是要沙子都是中国地里挖出来的？还是设计团队不能有外籍员工？。。。芯片又没有护照号
Evan172,people,自动驾驶/芯片开发,1,2018-05-05 14:00:12,4,0,确实弯道了，只怕车没超成，自己都开出赛道了，连比赛的资格都没有了。先说下，一条产业链上上下游之间是合作关系，同行才是竞争关系。IC公司发展得如何，主要靠自己产品的定位，在细分市场里有更好的竞争力，如性能、面积、功耗、成本和上市速度等，CPU core只是其中一个模块，拥有此core的厂商是其供应商，不管你是ARM、Intel atom还是RISC-V，你们谁好我就用谁的，最好价钱合理、服务到位噢。至于觉得用上XX方案就能弯道超车啥的，那是想多了。又不是市场独门绝技，你可以用我也可以用啊，你使用了觉得效果不错，我马上也用上，还是靠自家产品的PK而不是某项秘籍。怎样让IC设计公司愿意尝试自己的方案且从中受益，再逐渐推广开来，占有一席之地，这才是此类问题的正确打开方式，不要把主体都弄错了。当然供应商喜欢讲success story，XX客户用我们的产品，获得了多大的成功，你也可以拥有噢，亲！说更白点，你成不成功是你的事情，太多因素决定了；只要你用我的方案，用的人多了，我就先成功了。拥有XX牌轿车，让你出行更方便；拥有XX牌家具，提高你生活的品质；拥有XX手机，让你更有逼格……你是否真的出行方便了，生活品质提高了，逼格提升了，我不关心，只要卖车的、卖家具的、卖手机的赚了钱就行了。
fuu,people,,-1,2018-12-13 18:10:28,3,2,学驾照的时候，教练告诉我弯道要减速，不然科目一二三四都会挂。。。
CMOS,people,778106303 computer architecture讨论群:。cpu弃坑中。,1,2018-05-12 10:10:40,1,0,指令集本身和你实现出来的处理器是什么性能是两码事。riscv没有各种授权方面的限制这个是比较好的地方，不过感觉现在生态推得比较慢，而且主要是集中在微控制器这块。你说要和x86，arm竞争，不仅要看性能，还得有生态，看看arm进军服务器市场现在是啥状态。不过riscv指令集比较规整，而且基本没有其他指令集前向兼容各种奇怪功能的问题，这个对做高性能的处理器是真爽。
kuzhushu,people,码工,-1,2019-06-11 21:03:13,0,0,特离谱能禁你ARM，为什么就不能禁你RISC-V啊？RISC-V仅仅是开源，而不是没有版权的。
马泽依,people,保守主义,0,2019-05-26 02:57:45,1,0,特朗普已經欽定了 你們以後就用這個吧 別想什麼x86 arm了手機IOT之類產品有個特點 用戶不會要求這玩意兒能夠運行比如十年前的軟件 能運行最新版就好了 不會產生用戶想從intel換成龍芯 但是軟件不兼容這個歷史問題這也是一種後發優勢吧
臧大为,people,小白计划：http://51xbx.com,1,2019-05-30 15:14:42,0,1,能不能弯道超车，得看和美国关系的发展。如果真彻底翻脸了。美国全面禁止高科技行业卖给中国产品与技术，那么没有EDA软件，没有台积电流片，中芯被断供，那么别说超车，走路都困难。如果不跟美国闹僵。那么ARM技术还能继续授权，RISC-V如何发展起来就是一个难题了。RISC-V采用了BSD协议，这个协议是非常宽松的。也正是因为宽松，使用BSD协议的软件发展都想到凄惨，因为只有人索取，而没有人贡献。软件如此，硬件更是如此。
马吃马,people,营销策划/互联网,1,2018-11-29 19:13:29,0,0,开源这种做法更利于形成生态。目前的技术发展逻辑更在于搭建生态，形成全链条的相互带动共同发展。详见回答：如何评价“区块链技术是实现民族科技弯道超车的重要机会”这种说法？
jiangtao9999,people,不敢爱国的玩Linux的会计，但其实从小想做画家，现在想做科幻画家，求教程,-1,2018-05-05 11:04:19,11,18,不能。尤其是不能和 MIPS 对比。RISC-V 本身设计就是超精简的，比 ARM 还要精简，现在即便有改进，依然是从精简起步。这就导致 RISC-V 本身就无法实现高性能的运算。顶多是用在不追求极限性能，但是对成本和功耗敏感的应用方向。这东西目前来看，也就是能在低端 ARM 市场上有竞争力。干掉高端 ARM 目前还是只能看看再说。至于 MIPS ，本身其实定位是高于 ARM 的应用层次，当然 MIPS 现在已经放弃治疗，开始做 IoT 产品了。但是本身 MIPS 前期的基础指令设计都是针对性能，指令数量比 ARM 基础指令还多很多。所以美国芯片控制中国，其实主要的控制都是高性能芯片的销售。但是高性能芯片在超级计算机上，可以靠异构实现。而异构对于设计来说，其实难度反而不如通用高性能芯片高。只是研发成本，生产成本的限制无法大规模的进行市场推广。现在中国真正被美国限制的产品，其实是中层（当然这个范围比较广）的通用芯片。这种芯片的应用都是大范围使用，对于成本性能功耗都很敏感的。你肯定不会花 10000 去买个和红米一个性能配置水平的东西吧？所以你不得不去买 ARM 的 CPU 。包括计算机也一样。这其中，即便给你 RISC-V ，而且保证他能有相同的性能，国内其实也没有对应的技术保证这个 RISC-V 做出来的 CPU 真的能有相同的水平。因为国内技术欠缺的太多。只能在低端不追求某些参数的情况下，才能实现美国芯片的替代。说回 MIPS ，这东西是为数不多的能和 Intel 对标的指令集了。弃疗的 MIPS 用的是 nanoMIPS 。其实早期的 MIPS 指令集还是有高性能可能的。而 x86 的高性能，其实主要基于他的大量扩展指令，比如现在Intel 主推的 AVX 系列。国内如果想赶超 Intel ，必然也是在一个指令集基础上，增加扩展的性能指令。这点来说 openpower 和 opensparc 两个指令集虽然都比 RISC-V 有更强的性能优势，但是这俩后台过于强势，MIPS 这种基于等同于已经入土的后台公司，反而国内进行发展限制更少，而且本身又因为有一定的演进基础，不至于向已经彻底入土的 alpha 等指令集，现在和自己重头设计新指令没什么区别了。
软件民工,people,,1,2018-07-14 21:13:10,0,0,先不考虑有多少困难，先想想，这个东西究竟能不能在未来成为一个流派。从以前的经验看，这种开源的架构，一旦能够成长起来，趋势就不可逆转。比如arduino，比如linux，当初肯定也有人说不行。只要有足够多的人支持，它就一定能够成长起来。从现在的支持度看，支持者还是挺多的。一些互联网巨头都加入进来了，印度也给予了国家支持。中国倒是不必急于以国家身份支持，但是可以用民间形式参与。因为考虑到政治因素，中国以国家身份支持得太热情，或许会让别人觉得这是中国的cpu，反而会撤销原来的支持。等 势头起来了，中国政府再出面支持不晚。
