name,type,headline,gender,created_time,vote,comment,content
Acrad,people,辛辛苦苦抖机灵，然而没人看。,1,2018-03-24 21:34:49,217,131, 直接上图 中国的主要出口对象都有哪些？中国的主要出口 中国的2016年出口总额约2兆多美元，其中美国是中国的最大出口国约占中国总出口额的20%，也就是说中国对于美国出口了价值约4000多亿美元的商品，这次特朗普打算对500到600亿的中国商品收取高额关税，也就是说十分之一的中国产品会遭到致命打击。 中国对美国出口了什么商品？中国对美国出口中国对美国出口的商品基本上就是代工商品，像电脑 玩具  电视 手机 显示器 打印机等等产品除联想 大疆等少数自主品牌以外，大部分都是美国的dell hp apple乃至samsung sony bosch等第三国的产品，中国的大部分品牌在美国的认知度其实是非常低的，在美国卖的好的外国品牌主要还是日欧韩。 美国的主要出口对象都有哪些？美国的主要出口对象 从上图可以看出美国也是一个出口大国，美国的出口总额约1.4兆美元。美国对中国出口了什么？美国对中国出口美国对中国出口最多的是农产品，其中又以大豆为最大宗。其他比较多的还有航空航天产品 汽车 半导体，在机械方面美国对中国出口最多的是医疗机械，都是高附加价值商品。值得注意的是美国的出口产品的不可代替性非常高，因为美国在航空航天 医疗医药 半导体技术 农业的技术独步全球，很少有竞争对手。 非常有意思的是，从上图来看美国好像出口最多的是农产品，这和我们认为发达国家出口的都是高附加值工业制品的映像不太一样，其实不然。美国都出口些什么？可以看出美国虽然作为农产品出口大国，但是主要出口产品还是以工业品为主，让我们再多看几张图。美国对加拿大的出口美国对加拿大的出口工业品居多美国对墨西哥的出口美国对墨西哥的出口 也是工业品居多美国对德国出口美国对德国出口美国对日本出口美国对日本出口 结构开始和中国差不多了，可能跟日本的粮食自给率不高有关。美国对韩国出口美国对韩国出口 发现农产品占比也不是很高，也以工业产品为主。也就是美国对中国的出口产品结构比较怪异，其中美国对于中国的高科技产品禁运可能也有一定关系比如部分半导体生产产品 科学仪器等等，但影响应该不是很大因为美国对其他国家的出口产品大部分也是在中国有售的。 另外关于对于美国的粮食进口问题反而是问题的重中之重，美国打击发展中国家最好的方式既不是科技产品禁运也不是军事打击，原因在于绝大多数发展中国家对于高科技产品的依赖并不是很大，并且自身的科技实力也无法仿制美国的高科技产品，就好像伊朗 俄罗斯即使拿着intel corei7和ge90自身也很难仿制出来；军事打击的政治风险则太大了，阿富汗 伊拉克 的教训证明打倒敌国政府和彻底占领敌国不是一回事。 但是经济制裁和粮食控制怎是非常要命的事情，发展中国家严重依赖外资是普遍事实连中国也不列外。以中国对美国出口图为例，中国对美国的出口当中其实绝大部分是以美国企业自身产品和承接了其他国家对于美国出口的一部分转移，当美国对中国实行惩罚关税时实际上相当一部分是把板子打在美国 日本 韩国 欧盟和中国台湾企业的身上，这是特朗普要制造业回归美国的计划的一部分。 粮食控制则是更为阴险的手段，发展中国家对于粮食的价格实际上更为敏感，因为发展中国家的人均收入偏低拉抬粮食价格造成影响更大，最坏的结果就是政府被颠覆。很多人提到要对美国的大豆进行报复，我认为这是很不实际的。大豆作为攸关粮食安全的主要作物之一，当中国转向其他国家进口大豆时其他国家的大豆产量是否可以填补美国的缺口？如果中国选择自主大规模种植大豆，那么大豆这种亩产量较低的作物会不会侵占其他粮食作物的耕地面积？会不会带来其他粮食比如玉米甚至是大米的涨价？如果中国选择自主种植大豆然后进口比较便宜的东南亚大米，那么国际的大米价格会不会被华尔街疯狂抬升？最后粮食价格的上涨会不会带来进一步的通货膨胀？在大部分中国人受困于房价所带来的恶性通货膨胀时还能不能同时扛住粮食的涨价？如果中国人选择购买粮食保命，那么我们的工业怎么办？在内外夹击下如何升级？ 只能说美国果然高手如云，能够在中国最为脆弱的时候直打三寸，中国到了最危险的关头。
TIM,people,,-1,2019-06-04 15:43:37,1,1,中国对美国出口的商品基本上就是代工商品，像电脑 玩具 电视 手机 显示器 打印机等等产品除联想 大疆等少数自主品牌以外，还有就是低端加工品日用品、服装、袜子、牛仔裤之类。本身这些低端加工品或者说代工产业已经向南亚比如印度越南马来西亚等国转移（因为成本优势），本身利润已经相当低廉，美国再施以重手这是逼迫中国的大量产业工人失业，老板破产，经济低迷，大量的多余产能是不能靠国内消费来消化吸收的。不可能永远靠房地产赚钱，所以无论怎么打鸡血，最重要的股市是一直低迷，这个和印度股市10年涨4倍形成鲜明对比，印度的股市也反映和契合了上面所说的产业转移逻辑，实际上阿三除了爱搞强奸外，国家的外部环境和经济潜力还是很好的。总之，经济形式只能越来越差，美帝是个有长远策略的国家，无论是特朗普还是其他总统，区别只是明搞和暗搞。不过不用担心，既然消费靠不住还能靠啥？我们还有夜壶，基建投资，和4万亿刺激。
Tylor,people,,-1,2019-05-13 19:14:26,3,0,从进出口清单就能看出，中国出口工业品，美国出口农产品，这是工业中国怒怼红脖子美国，优势在握，稳操胜券！
风捎来的消息,people,触摸屏结构工程 画图的,-1,2018-04-11 08:46:57,4,5,加税的作用是什么？加税最终导致不过是提高物价！物价提高导致客户寻找新供应商？中国制造加25%难道美国就能不进口中国的商品？现在中美并没有开战！美国难道宣布了不出口农业产品和半导体给中国？特朗普去宣布一下贸易禁运试试！看看他这个总统还当的下去不！中国是124个国家的第一贸易伙伴！世界绝大多数国家已经没有完整的工业体系！中国进口原材料出口成品商品总价值肯定要高于原材料才有利润！美国出口中国都是什么？难道出口芯片，进口手机还能让芯片价值贵过手机？第一个回答私货太多！说贸易战变成制裁l？加税和制裁差别很大！美国真能联合多数国家制裁我国！那么说什么都是屁话！开战
高黑手,people,外汇,-1,2019-05-19 12:21:44,0,0,不错的问题，回答的数据很全面，非常有用，也希望能关心贸易战对我们生活影响的朋友多讨论这些问题，贸易战本是调整贸易状态的好事，中美从互补到竞争发生贸易战是必然的，关键在于对后续的预测，经济方面的变动对我们来说是赚钱的机会，特别是搞大宗商品以及股指期货的。如此次关税过程，要加，说明10次谈成了屁，不需抱幻想直接看跌，刘去谈，必然有反弹的可能，每次加，中方总能令其推迟，忽悠功夫了得，美方也总是出尔反尔，也不好意思了，此次不好变化，势必加税确定，公布后，必然狂跌，看跌刚好获利了结。毕竟，主力判别的信息比我们多，几天前已看跌了。所以，下跌过猛必然反弹，可抢反弹（有点刀口抢食）。中国的面子很重要，后续必然强势反制，对股指来说，反弹必跌，可赚几次。
