name,type,headline,gender,created_time,vote,comment,content
吴天明,people,俄罗斯品牌蜂蜜销售商 WX：18145190991,1,2018-04-21 11:08:13,8,0,1，百分之97的工业产品，中国均能仿造，从技术储备上，装备硬件方面，中国的实现了完整工业化进度，所以我们是制造大国，对于这些工业品，我们国家不存在难度，如果不考虑知识产权专利等问题，那么基本上你在外国能看到的，在中国也必然能看到。2，剩余的百分之3的工业品，是中国现在还不能制造的，无论从技术储备和装备硬件等方面，中国还有一部分的工业制成品无法自己独立完成，这一部分对我们国家来说是非常困难的，也是一直是制造大国不是制造强国的却别。3，在著名的工业强国中，并不是靠低端的锅碗瓢盆的工业化来概括的，所谓的工业强国是高尖端的工业生产。光刻，芯片等都统称为高科技产品，这一类我们国家是弱项，其实是有根源的，本身的材料学不过关，然后是相应的应用工程然后是精度方面。4，我以前是军工，举例一个简单例子，一个飞机假设25万零部件的情况下，则任何一个螺丝是50年代产品，则飞机是50年代飞机，不是现在的产品哦。不是说人家拿一个螺丝来，我们就能仿照一个螺丝，那是外形而已。这个螺丝的成分，是什么材料制作的，为什么有几个丝，为什么这个角度安装，为什么安装这里，为什么这个口径，为什么这个杆进深度，甚至向什么方向旋转多少圈都是基础知识的积累。那么这还是基本的工业制造，如果是电路方面，然后是高精密集成电路，甚至更加复杂的超高精度的制作。我们需要工业母机。工业母机其实是民间称呼，就是笼统来说是一个制作加工螺丝等配件的机器，这个机器出来的零件用来组装总成一个加工机器。所有零件的进度都是根据母机的进度向下递减的。也就是到了后来就是我们手中的螺丝刀螺丝螺母。材料学的不过关，很多东西找出来只是外形，根本达不到理化系数要求，也就是人家发动机1000小时工作，我们300小时工作。那么我们国家能不能做到？能够做到，集中国力可以制造出来某些高尖端东西，甚至世界前列，但是能做几个？对就是几个。真正的工业强国，他们的潜力是你所谓所了解的高尖端这些东西，人家可以流水线样子的给你批量生产，每5分钟一架飞机，3分钟一辆坦克，1个星期下水几百军舰这是工业强国的体现。而中国能做到是人工手工来实现达到精细度，这样就造成某些精细配件我们需要少量精密工人手工制作，我们的机器还不能制作出这种精度。我们已经是工业大国，我们也可以和外国一样几分钟一架飞机制作出来，流水线的铺张开来，我们有自己的工业体系。这是值得骄傲的。但是里面的细节上，甚至某些关键代表性能的东西，我们差距是非常大的，也是不能忽视的。通过手工来实现的某些高尖端并不是能够广泛应用的。只能说我们国家有能力达到，但是距离尚远。我们国家进口了那么多飞机，如果真的那么容易拿一个就造出来，那么我们也不会刚刚飞大飞机了。很多东西，我们看的都是外观而已，实际参数需要的理化性能我们达不到，甚至用什么材料配方都是我们未知的。简单例子，人家卖给我们飞机图纸，所有零件图纸我们都有了，但是制造这玩意某个零件需要某个钢铁厂生产，那么我们需要专门生产一个钢铁厂来生产这个材料，而可能只要一个螺丝。那么你配套一个钢铁厂来生产螺丝，可是我们只生产一架飞机。所以这个钢铁厂只生产一个螺丝？其实绕回来还是人家知识产权，如果你排除这个这是产权问题，那么很简单我们可以通过时间来造出来。可以说如果没有知识产权问题，我们将会减少很多时间，因为太多未知的大门敞开了。如果，没有知识产权，我们是不是能立刻造出来，某些可以，但是某些并非可以。因为知识吸收和沉淀甚至延伸都需要时间。这个时间甚至是无限长的。可能研发一个科技也就几年。但是吸收转化并且自己动手复制实现自己独立生产然后产生配套生产等我们可能需要10年来完成。这还是快的。简单说，现在很多飞机都是50年前就做出来的图纸。很多船舶甚至高了说我们的神舟那些都是几十年前的东西。周总理时期，我们的神舟就出来了，但是没有能力制作就放着，有能力了我们拉出来换了新的电器设备，我们就上天了。实际上还是那个神州并没什么进步。技术的研发水平是超越当今制作水平的，制作水平是限制科技水平的重要因素。而制作水平的限制是人，知识，设备。那么换成毛概论或者资本论就是说劳动力、劳动工具、劳动对象。我们这里的劳动力，指的是接受过高等教育，能够胜任高科技生产任务，具备自我研发，自我拓展，自我设计，自我制作等独立工作能力高尖端人才。这方面我们和外国比差距很大。劳动工具，我们说了我们在材料学匮乏前提下，可以说很多工具我们还达不到外国的精度，也无法实现更高层次的工业加工。劳动对象，我们没有足够的劳动力和足够的劳动工具对劳动对象进行更加深度开发和生产。所以这是就是我们国家生产力落后别人国家的地方。你提出的知识产权问题，实际上就是广泛的假设技术知识方面我们不存在障碍。那么我们还没有掌握这些技术的人力。只有我们拥有了一批这样的技工和高工之后，我们运用这些技术制作出高精度精密工业母机。然后用这个相对超越世界现在科技水平的工业母机，制作出二代机，然后用二代机制作出配件，然后制作出工业品。那么这需要一个相对漫长的时间。也许需要几十年。
北云,people,无业游民,-1,2018-04-21 12:00:56,2,0,这个当然是不可能的，即便不考虑知识产权，也不可能做到和人家一样的程度，因为西方的技术壁垒不是一成不变的，而是一个动态的更新的生命体，知识产权获得的垄断利润，用于再开发。而这个利润不止是西方的利润，还包括中国市场的利润，也就是说中国一直再给西方输送开发资本.当然没钱还不是最关键的，最主要的是没有人才。没有知识产权保护，就没有开发性人才
张旭,people,创业者。还需要学习很多东西,1,2018-04-19 09:45:39,1,0,可以，但是有难度。
YU-NO,people,玩具行业边缘从业者/独立玩具周边测评人,1,2018-04-20 09:40:07,1,0,做不到，就是做不到。不说别的，至今为止国内盗版的高达模型都没有一个可以做成跟万代的一个水平。这已经比什么光刻机低端了上万倍都不止了。想做就做？你莫不是以为自己是神仙吧？
枫清扬,people,,-1,2018-04-21 20:13:19,0,0, 不注重知识产权，创新没有丰厚，如何激发创新热情。我们已经过了山寨阶段了，该重视知识产权保护了！
塔普伦寺的猫,people,,-1,2018-04-20 19:08:33,0,0,你所说的知识产权可能只是指专利，专利的目的只是堵别人的路，竞争力靠的是其实knowhow。
半截仙,people,dota2,-1,2018-04-20 10:27:20,0,0,不能，能抄的都抄的差不多了，剩下的是怎么抄都抄不出来的，需要基础科学研究花费大量时间来补。
