name,type,headline,gender,created_time,vote,comment,content
非说不可,people,哪有什么理性 全都是屁股,1,2018-04-04 13:48:30,8214,516,"如果我们的敌人激烈的批评和反对我们，我们一定是做了什么非常正确的事情。----------------------------------------------------4月16更新针对大家的评论集中回复一下1，是否出自毛选？答：改写自毛泽东在一九三九年五月廿六日,为纪念中国人民抗日军政大学成立三周年所写的文章《被敌人反对是好事而不是坏事》：""如若不被敌人反对，那就不好了，那一定是同敌人同流合污了。如若被敌人反对，那就好了，那就证明我们同敌人划清界线了。""2，按这么说，我们这么反对贸易战，美国人是不是也做了什么很对的事情？答：双方都没错，美国在这个时间点上发起贸易战遏制中国，从国家战略的层面上来说绝对是正确的选择，再之后等中国完成了产业升级就什么都晚了，从美国人民的角度出发彼之仇寇，我之英雄，可以说做的确实很对。但是我也很不理解那些为美国打击中国幸灾乐祸的国人，到底是怎样的臀脑分离……3，美国不是敌人！答：美国都怼到脸上来了，还想逃避真相，我想这很明显是一种畏惧心理。为此我再借用毛泽东一句话：“第一条，坚决反对战争；第二条，如果帝国主义一定要打仗，我们就同它打。把问题这样想透了，就不害怕了。”最后挂个人，我觉得和这种人没什么好讨论的:"
吴月娘,people,卖了金莲真开心！,0,2018-03-23 13:16:52,385,71,全球股民恐成最大输家行啦知道你们这群小天才没赔了，放过我这种赔成狗子的人吧
Fred Hu,people,袍哥人家，认黄认教，绝不拉稀摆带,1,2018-04-04 22:07:34,652,0,邓小平对此有很精妙的评价（90年代初西方各国对中国实行的贸易制裁）：民主国家的政治变化很快，严厉的制裁最多只能延续几年。外国商人会向他们的政府施压改善对华关系，以便他们能够进入中国市场；外国政府也会重新认识到需要中国的合作。中国要站稳立场，鼓励外国友人终止制裁，为好好利用将来的每一个机会做好准备。至于要如何应对，也讲的很清楚概括起来就是三句话：第一句话，冷静观察；第二句话，稳住阵脚；第三句话，沉着应付。不要急，也急不得。要冷静，冷静，再冷静。埋头实干，做好一件事，我们自己的事。
三金,people,,-1,2018-04-04 12:20:34,2212,276,最新进展是中国4号下午也宣布了反制的措施，对从美国进口的约500亿美元的大豆，汽车，化工，飞机等106项产品加收25%的关税。可以说之前大家猜测的重型武器很多都用上了。中国清单的指向还挺明显的，通过美国民众和商业人士给特朗普施压，让他在谈判桌上能正常点，别漫天要价了。不过能不能奏效，还真难说，因为特朗普说不定认为中国是挑衅，又放更大的招。那可能就引发多米诺骨牌效应，无休无止了。有些评论说到之前的计算问题。的确，我是简单的比较了一下，只是想说明对于中国整个宏观经济的大盘子来说，这个数字的确不是很大。当然对具体的行业部门公司，这是重大的压力。还有一点，目前所有的讨论都是假设性的，具体实际经济活动中的变化，不是一个两个数字可以描述的，所以到底这个125亿美元的影响是大是小，都要有针对，有语境。贸易战或者这种严重贸易摩擦真正可怕的，可能是对市场预期的改变。本来世界经济都有点复苏迹象了，全球最大两个经济体在经贸领域开始对峙，这会是什么效果？再次陷入衰退也不是没可能的。最后，手机打字真累...————————忍不住回答，因为有些楼上的评论一些基本的事实不正确。第一，美国宣布的是对中国价值500亿美元的进口产品征收额外关税，国内很多都说是600亿美元。来源估计是特朗普的口误，可是特朗普自己都经常搞不清楚他在说啥。500亿美元是USTR确定的，而且是进口额。加征关税的金额是增加的25%*500=125亿美元，占整个中国对美出口可能也就2-3%吧。所以真正经济的影响不是很大。第二，中国之前公布的对美国30亿美元进口产品中止关税减让，是针对美国对钢铁和铝进口产品加征关税的决定的，也就是通常说的232调查。而这次美方500亿的清单是针对中国知识产权发动的301调查。两者不是一回事。中国已经表态了肯定会反击，而且是同等规模、同等力度、对等措施，也就是说到时候宣布的清单也会是500亿美元的。第三，美国是一石多鸟。特朗普从面子上是兑现竞选时的一些承诺，主要是降低对华逆差。但更重要的是，遏制中国在新兴行业方面的快速发展。简单说，就是战略意义大于实际的经济意义。
Ezawa Tami,people,活跃在理论化学/统计/CS的文史哲爱好者,1,2018-04-06 23:25:50,1135,255,"置顶：由于我不开私信，所有脑残评论，尤其是涉及人身攻击的，我都会给推荐。还有想给FBI告密的，我能笑死。我周一早上带律师和first amendment等你，有种就来，没种就滚。我百分之二百确定，如果我因为反对Trump的脑残行为被FBI定罪（which they can't)，学校会出面保我的（笑）一更两个链接：http://finance.eastmoney.com/news/1345,20180410854599110.html【人民日报：中国扩大开放新举措不适用于违反世贸规则的国家】人民日报评论文章指出，中国扩大开放的新举措将惠及不少贸易伙伴，但不适用于那些违反世贸规则、动辄对别国发动贸易战的国家https://finance.sina.cn/2018-04-10/detail-ifyteqtq7106510.d.html?from=wap&wm=3049_0016&from=qudao&sendweibouid=2817813520二更特朗普碰瓷的大推特：（敏感）看了一下金灿荣教授的想法，有个朋友总结得很好，美方要求无非是四点：1. 于今年立即减少1000亿美元的贸易顺差，方法中国自己想，美方不会负责。2. 对于美方知识产权的保护，停止以市场换技术的行为。3. 金融市场与电商市场向美国更全面的开放，比如金融市场美方控股的比例可以达到51%。4. 即刻停止2025制造业升级计划，中国政府不能补贴10大行业。这是骑在你脸上拉屎，就这么恶心。这还怎么谈？没得谈嘛，打一架来看看呗？还吹风说双方在谈判，先打烂你的奶瓶：https://m.wallstreetcn.com/articles/3272753这就像是美国说我俩来谈判一下你如何吃掉我喂你的屎的问题。这也能谈？谁和你谈。你美国满足我四点要求，我们再来考虑谈判问题：1. 于今年立即停止对中国的科技和贸易限制，什么瓦森纳协定里的东西必须半价卖给中国，钱不够办法你自己想，我们不负责。2. 无偿向中方转移全部相关专利，不得附加任何条件。3. 美国金融市场和其他实体经济应该允许中方控股51%以上，国会与政府部门无权干涉。4. 美国立刻停止对NSF、NIH等高科技研发基金的投入，美国政府不允许补贴任何行业。要中国人一辈子给美国人打工，你他妈休想！富士康流水线的产业工人、面朝黄土背朝天的农民兄弟、科技公司加班到深夜的程序员、传统行业天天出差赶项目的工程师、起早贪黑进货出货的小商贩，哪个不更应该比伯克利街上那些不被计入失业人口的hippies值得更好的生活？“打不打，还是时间要打多久，我想我们不要做决定。过去是由杜鲁门，以后是由艾森豪威尔或者美国将来的什么总统……由他们去决定。就是说他们要打多久，就打多久，一直打到我们完全胜利为止。”——毛泽东"
弦断,people,,-1,2018-03-29 18:54:01,4736,340,1.为什么中美会挑起贸易战很多人都说，是因为中国的科技在进步，美国见不得中国科技进步。之前特朗普打压华为就是一例。不过，也有人一针见血的指出：美国为何要执意发动“贸易战”，关键原因还是中国的某个举动，相当于动了美国的“祖业”。2.美元为什么是世界储备货币？当今世界，很多都是以美元结算的。因为美元是世界最重要的储备货币。实际上，在美元之前，还有两种货币也曾是世界通用的储备货币：荷兰盾和英镑，都与荷兰和英国曾经的殖民帝国身份有关。二战之后，美国通过布雷顿森林体系成功把美元“送”上了世界储备货币的位置。然而随着1971年布雷顿森林体系的崩溃，美元几乎要损失掉自己世界储备货币的地位。幸好当时以时任美国国务卿亨利·基辛格为首的外交团队与沙特阿拉伯王室经过数轮谈判，最后达成协议：美国以供应军事武器为代价，换取石油出口国以美元计价和结算的结果。最终，美元靠着石油，再度坐稳了世界储备货币的地位。而美国也因此建立了所谓的“石油美元”体系，并通过OPEC进一步加强。想要买石油？请拿美金买。那石油暂时卖完了怎么办？别怕，还有美国国债。因此，美国就建立了美元霸权。也正是依靠美元霸权，美国赚的盆盈钵满，正是由于美元经济给能带给美国惊人的利益，谁要是挑战美国的美元霸权，美国就会玩命的跟他死磕到底。对于美元建立的石油霸权，还围着不少的阴谋论：有人说，无论是攻打伊拉克还是拖垮了整个欧盟的希腊债务危机，都是美国为了阻止欧元取代美元成为石油计价货币的政策。可以说，无论是谁想要挑战美元霸权，甚至是美国的铁杆兄弟欧盟，敢碰美元的底线就是要被对方软硬兼施，结果只有死路一条！3.谁也不敢做的事，中国却做到了然而，正当所有人以为，没有国家敢于再挑战美国通过掌控石油，从而得来的美元绝对霸权时，中国却“逆流直上”！2014年，俄罗斯率先发力，在和中国进行石油贸易时使用人民币结算，打响了“反美元”的第一枪！随后伊朗、甚至被美国“解放”的伊拉克也“跟”了上来，许诺可以用人民币结算石油。委内瑞拉更绝，直接承认人民币才是石油结算货币，而不是美元！经此一役，如今中国三分之二的石油采购可以实现了人民币结算，多年依附在石油身上剪羊毛的美元被抛弃了！为彻底击破美元霸权，中国再出创举：任何接受人民币作为石油贸易结算的石油出口国，都允许将获得的人民币在上海黄金交易所兑换成黄金！要知道，当年布雷顿森林体系的核心就是黄金。因此中国这么一干，美国彻底“慌”了：如果人民币的信用和黄金的信用挂钩，那么美元的霸权也将变得岌岌可危！就连美国最大的盟友，当年帮助美国建立石油-美元体系的沙特其实也可能正处于动摇之中。其原因非常简单：沙特目前出口给中国的石油超过美国，并且中国正在积极推进用人民币结算所有能源进口交易，既然中国现在是沙特最大的客户，那么中国对沙特的影响力很可能超过美国。要知道沙特是中东石油出口国的“龙头老大”，失去了这个盟友，美国将很难再打“翻身仗”！而更让美国担忧的是，3月26日，中国首个国际化期货品种：中国原油期货在上海期货交易所正式挂牌交易。中国价格，将影响国际油价。难怪，特朗普要那么不顾一切的向中国宣战了：因为这一次，中国真的敢做到了之前别人不敢做到的事。而美国却日显疲态，见不能在边缘政治问题上打压中国，便拿中国的经济下手。不过走到如今这一步，中国也自然不会坐以待毙！
狄客天行,people,,1,2018-03-23 14:21:12,1378,182,"谢邀。整个对抗的原因以及手段，请看班农演讲自述，至于那个什么工业国和农业国的图一点都不好笑，那是为了拖延中国科技采取的手段，真没什么好笑的地方。班农2017年12月17日在东京的演讲不过还有像我这样的人还有美国优先运动的人，我们说，让我们尊重尊重中国领导人的劳动，去好好听听他们的讲话，格外注意他们在对我们说些什么吧。他们是非常直白的，他第十九次代表大会的讲话，长达3.5个小时，我在过去的几个星期里谈了七八回了。对象是一些美国的团体，不同的团体，例如茶党，美国的犹太复国主义组织，基督教团体，信天主教的选民，民粹主义团体，某些对冲基金经理，我跟他们都讲这同样的事情：今天西方面临的危机就在于，他在他发表的3.5小时的讲话中道出了他们未来全球霸权统治的计划，而西方对此根本没有人关注。《纽约时报》可能会有一篇报道， CNN做了一篇报道，伦敦的《金融时报》做了一篇报道，《华尔街日报》做了一篇报道，但是当你观看美国电视节目时，你不会看到对这条新闻的大幅度报道，你看不到连篇累牍的文章，没有人关注它，就好像根本没有这件事。其实美国的电视节目，它缺乏我们所需要的严肃性，美国电视节目播放那个演讲时差不多是只播出了他的那部分，他已经91岁，大家还记得看到他坐在那里用放大镜在阅读演讲稿吗？他一直看着他的手表，因为这场演讲长达3.5个小时，而且我相信在91岁时，能全程坐下来是很了不起的一件事。他们就播出了这段！这是美国和全球媒体从中获取的，你知道的那种，搞笑的部分。但那个讲话一点都不好笑，本来就不是为了好笑而作的讲话，它是讲来在告诉全世界，这是我们努力的方向，这就是我们要做的，这就是我们如何去成为主宰全球霸权的大国。对西方来说，这对西方也不仅仅是一个警告，它实质上是说儒家重商主义的权威模式已经赢了。犹太基督教的自由民主，自由市场，资本化的西方已经输了。没有比这个更加直白了。事实上，这个演讲中中国领导层的计划有五个方面，他们基本上是在规划未来几年发生的事情，他们认为他们实际上会控制世界的主导地位。第一是2025，你听说过2025计划吗？这是中国领导层几年前提出的一项战略计划，掌控全球10个产业，其中3个产业，芯片及硅片制造，机器人和人工智能，将使中国在21世纪里统治全球的制造业。第二是一带一路，一带一路是中国真正大胆的地缘政治扩张。每当我作为一个鹰派在美国各地谈到此事时，他们都说，哦，哦，班农，你错了，你错了，中国人从来都不是领土的扩张主义者。他们其实是地缘政治的扩张主义者。     19世纪和20世纪有三个伟大的地缘政治理论，它们塑造了19世纪和20世纪。麦金德Mackinder是苏格兰人，马汉Mahan和斯皮克曼Spykman。一带一路的大胆之处，就是将三个地缘政治因素结合在一起组成一个完整的计划。它结合了麦金德关于谁控制了中亚腹地，就控制了世界岛，控制了世界岛就能控制世界的理论。亚历山大大帝，拿破仑，希特勒，彼得大帝，这些世界伟大的征服者都明白这一点，麦金德就是以此来创造出他的理论的。丝绸之路的扩张，把中亚这些重要的国家联系在一起，用孔子重商主义的市场模式真正地把伊斯兰教政治统一到一个市场中去，那就是一路，或者我认为是一带。一路是马汉理论的产物，这还是大英帝国和后来美国的战略计划的基础，就是把沿途的主要港口都连接起来。   对了，今天你们能看到中国人在波斯湾，吉布提，南中国海这样做，谁用海军，用港口控制了世界岛屿，谁就会控制世界。他们把麦金德Mackinder和马汉Mahan的理论结合起来，以前从来没有人做过。但是第三个实际上更加大胆，斯皮克曼Spykman，知道他的人要少很多。他的理论是关于从海洋向内陆的沟通线，他的理论是你得把侵略者远拒国门之外，在他们的势力范围之外，这是斯派克曼的理论，这就是为什么南中国海就是这个不断的远拒，这个不断的远拒，让日本和美国无法发起大规模的入侵。    所以第二点，首先是2025，然后是一带一路，第三个是5G网络，5G网络的新发布。中国在这方面比美国和世界其他国家先进得多。如果他们在世界其他国家之前完成这项工作，他们将再一次在科技技术上占主导地位。其次是金融技术，中国今天的一个弱点是目前西方以及日本和美国等国尚且可以把它从世界资本市场上踢出去。对它的公司实行真正的制裁，或者把它的银行从全球资金流中赶出去，或者将它的大银行隔离于全球资本市场之外。在5年, 7年或8年后，随着金融技术的进步，这种可能性将会消失，未来没人能够将中国和中国的体系从全球资金市场中踢出去。最后是开始用元，或称人民币，来作为汽油和所有石油产品的兑换货币。  中国要让美元失去储备货币地位。美元作为储备货币使美国承担巨大责任，但也使美国在世界资本市场有极大影响力。这五大方面，配合经济发展计划，是中国领导人认为他们应当走的道路。这样到2030或2035年，他们就可以成为世界第一经济体。15年以后，他们要成就世界霸权。西方对此是如何应对的？西方的反应是…直到特朗普当选总统之前，西方对中国的反应相当混乱。  特朗普总统的中心目标是重振美国，其中的重要策略是对中国的货币操纵、贸易不公平加以反制。我们要记得，正是由于往届美国领导人的错误，导致现在美国在许多经济领域已经成为中国的产品发售地，就像以前吉姆斯敦是英国的产品发售地。我们对中国的贸易逆差一年是5000亿。这还是扣除了我们向中国出口木材、铜、猪肉、牛肉、玉米、麦子、天然气、石油，还有波音飞机和苹果产品部件…不对，现在我们不向中国出口波音飞机和苹果部件了，他们在中国建了合资企业在当地生产，苹果几乎是中国（公司），他们有苹果云、产品都在中国生产，所有的产品创新最终也会出自中国…。  过去十年中国通过强制技术转让从美国拿走了3.5万亿美元的技术，这不是偷窃知识产权，偷窃知识产权行为可以用人工进行制止，可以通过加强网络安全，对商业间谍做更好的反制工作来制止。但这个却是献金或为进入中国市场付出的代价，一年3500亿美元！更重要的是，中国摘走了民主自由市场系统的花朵，那就是我们的创新。美国强大是因为我们的创新，西方一直都在领导创新。中国的要求是，如果我们的公司想要进入中国市场，就要交出他们的技术，交出他们的创新。特朗普总统开始实施301行动，我很自豪我参与了这个工作。301行动就是研究中国政府是如何强制要求以技术换市场，美国应当如何去纠正过来。接下去几周时间你们会看到特朗普政府公布对301报告的更多增加信息以及他们将要采取的行动。   还有一个报告是232，是关于钢铁和其他可能领域，美国如何限制中国公司进入美国市场。这些行动在美国并不容易，原因如下：美国的社会精英比如硅谷、华尔街、好莱坞，华盛顿的帝国资本对反制中国没有兴趣，因为他们从中国的经济发展得到了好处。是美国工人阶层，是中部和南部要进行对抗。美国成为产品发售地地使美国的工人阶层、中产阶层生活受到巨大冲击，所以你们每一天都看到工人阶层、中产阶层在跟那些想管理美国经济的精英阶层抗争。"
下一项,people,我曾经瘦过,-1,2018-04-04 11:56:30,142,15,加税范围集中于“中国制造2025”规划的十大高科技领域，现状来说中国这几块自用都成问题，出口并不大，真要缩减逆差的话应该对代工行业、中低端机电产品下手。川普当然知道中美贸易逆差其实是双方得利，缩减逆差纯属借口，目的很明确就是遏制中国产业升级，确保美国自己继续赚取超额利润。
夏元鼎,people,微博：夏夏夏元鼎,-1,2018-04-04 19:42:02,1732,0,谢邀中国最新的反制手段已经出来了，估计新闻各位也已经看到了中国对美国 106 项商品加征关税 含大豆汽车-ZAKER新闻有意思的是，这条儿上了热搜，那边儿推特讨论得正热闹呢中国这次手段之精准，反应速度之快就连新乡时报都没有猜到，至于特朗普团队有没有预计到我们暂时不清楚，但市场的反应是很明显的，你们感受一下国农产品期货全线大跌。美国玉米跌3%、大豆跌3.3%、小麦跌1.7%、豆油跌1.8%、豆粕跌2.9%。活牛跌1.2%、瘦肉猪跌5%。美国股指期货扩大跌幅，纳指期货跌1.6%，标普500指数期货跌幅自0.7%扩大至1.1%，道指期货跌1.3%。股市方面，A股三大指数临近尾盘全线下挫，沪指由红翻绿，创业板跌近2%。截止收盘沪指跌0.18%，深成指跌0.65%，创业板指跌1.90%。香港恒生指数在消息流出后跌1.7%，收盘跌2.2%，报29518.69点。腾讯控股收跌2.88%。美股盘前，飞机、汽车板块大跌。波音跌5%，通用汽车跌超3%，福特跌1.4%。欧洲股市全线下挫，德国DAX指数直线跳水，下跌1.25%；英国富时100指数下跌近0.5%；欧洲斯托克50指数跌幅扩大超1%。按照TG以前的套路，不被逼到绝路是绝对不会轻举妄动的，多少都会保留一点谈判的空间所以特朗普这次给的制裁清单，才会看起来显得不疼不痒，正是因为咬定了TG不敢全面开战，吃准了其之前的老套路，故意留给中国主动寻求谈判的后路然而没想到现在套路变了，中国直接把桌子掀了，这么看本届政府是真的朝着“2025中国制造”的崛起之路上奔的，因此主动求和是不会存在的，就看谁先熬不住吧最后引用一下财政部副部长朱光耀的发言：“中国从来没有对外部压力屈服，外部的压力只能使中国人民更加奋发图强，外部的压力只能使得我们更加聚精会神，促进经济的发展。外部的压力在另一个方面看是动力，来促进我们的创新，促进我们的发展。”最后趁着人多打一个小广告，大家可以关注我的，不会让各位失望的
