name,type,headline,gender,created_time,vote,comment,content
匿名用户,people,,1,2018-04-04 19:45:46,62,8,建议各位回答问题前先把时间线整理一下：3月8日，特朗普签署公告，决定于3月23日起对进口钢铁和铝产品全面征税，税率分别为25%和10%，即232措施。随后陆续对除中国外多国实施豁免。3月22日，特朗普正式签署总统备忘录，宣布将对中国进口商品征收关税。商品包括航空铁路、新能源汽车和高科技产品，宣称规模约为600亿美元左右。3月23日，中国商务部发布公告对自美进口产品加征关税，以平衡美方232措施对我国造成的利益损失。商品包括进口水果、葡萄酒和无缝钢管等产品，规模约为30亿。4月3日，美方正式公布301关税清单。建议税率为25% ，涵盖航空航天、信息和通信技术、机器人和机械等约1300个税号产品，涉及中国约 500 亿美元出口。4月4日，国务院关税税则委员会决定，对原产于美国的大豆、汽车、化工品等14类106项商品加征25%的关税。实施日期另行公布。以上就是贸易战的关键时间线。注意，这里明显是两个回合：第一回合是美国232措施，然后中国加征美国农产品关税；第二回合是美国301清单，然后中国加征玉米大豆汽车关税。这里大家一定要分清232和301，中国反制措施对应的是很分明的：商务部3月份公告（中方发布中止减让产品清单谈话）中对301清单只字未提，通篇都是再讲232；而最新发布的商务部公告2018年第34号，开头就明确表示是针对301。这里很多分析都将两个回合混为一谈，时间线再归纳一下：第一回合：钢铝制品对农产品，双方均实施。第二回合：高新科技对大豆汽车，双方均未实施。第一回合规模不大，贸易战小打。第二回合规模其实美方早已泄底，而中方看似日常来回其实暗中升级，动了双方都极为关键的玉米大豆，毕竟中国每向美国进口10美元就有1美元的大豆，同时美国大豆60%都是向中国出口。但最后很巧妙地把太极又推回去了：实施日期将视美国政府对我商品加征关税实施情况，另行公布。上周贸易战明显有缓和之势，连特朗普都发推说成果喜人。结果到了本周末又突然升级了，我这里有一个猜测和一个脑洞：猜测：中美谈判中方施压。按照之前的消息，美方主要是谈中方开放国内汽车业与金融业，而此次中美双方的清单汽车业都是重头戏，可能是中方在讲价，也可能是谈判急转直下。面上的清单更像是谈判的筹码，而不是实施结果。脑洞：与朝鲜金氏访华有关。三代上台这么多年后突击访华，时间点正好落在第一回合之后。中方对外密不透风，美方也一副完全无所谓的样子。这里面会不会有联系，目前还只能说是脑洞，但很难说完全无关。所以，目前来看：截止4月4日，维持原有判断不变，双方比起贸易战更需要的是嘴炮，贸易战小打而止（详见回答如何看待2018中美贸易战打响？）。另外，若真打到玉米大豆这一步。按我之前分析的上、中、下三条路，无非是由上路转进中路，离下路还远。目前大家安心工作，静观其变吧。
ammya,people,伦敦大学  fintech,-1,2018-05-29 22:50:37,4,2,打脸来啦，老美就是彻底不要脸啦…中国怎么办？我也不知道…我只知道我不能去美国生孩子再为美国添砖加瓦了…
武占国,people,财经原创作者,1,2018-09-21 16:50:27,2,0,"本文写于2018年4月4日作者：武占国​​编者按：2017年，特朗普上任以来，不断指责中国为汇率操纵国，并且持续保持对美巨大贸易顺差，2017年8月美国对中国发起的""301调查""，2018年2月中旬美国对钢铝产品进口的“232调查”报告发布，今天随着中国对美106项商品加征25%关税，贸易战再度进入白热化。美国对1300种征税VS中国对106项征税美国特朗普政府周二在与中国日益加剧的贸易争端中加码，宣布将对约1300种工业技术、交通运输和医疗产品征收25%的关税。今天中国发布对美关税反制措施 对大豆、汽车等106项商品加征25%关税。美国贸易代表署公布了此份年进口额达500亿美元的中国产品清单，其中主要为非消费类产品。清单覆盖的产品范围从化学产品到发光二极管，从摩托车到牙科装置等。这份清单将打击到很多美国制造商的供应链。外交部发言人耿爽周三表示，中美之间就贸易问题一直保持沟通。在推动通过对话协商解决有关问题上，中方展示了充分的诚意，开展了大量的工作。通过对话协商解决中美贸易分歧，而不应是漫天要价、胡搅蛮缠。中国发布对美关税反制措施 对大豆、汽车等106项商品加征25%关税。国务院关税税则委员会决定对原产于美国的大豆、汽车、化工品等14类106项商品加征25%的关税。实施日期另行公布。同日，国务院关税税则委员会公布对美加征关税商品清单。期货市场一半海水一半火焰周三，美国三大股指期货下挫，标普500指数期货下挫0.7%，道指期货下跌近200点。今天中国公布对美106项商品加征关税后，美国期货市场农产品再次迎来大跌。同时上海期货市场的螺纹钢等工业品也出现了大幅的下跌。另一面，中国大商所的豆粕、玉米等农产品出现了大幅的上涨，豆粕主力从2月初到现在，涨幅已有近20%的涨幅。除期货市场外，中美股市纷纷出现调整，日本、韩国等亚太股市也都出现大幅下跌，欧洲股市也因贸易战的影响出现了下跌。大豆、飞机是握在中国手里的“重磅炸弹”此前被加征关税的农产品，在中美贸易中属于“小宗商品”，贸易金额较少，可替代性强，即便不从美国进口，也能在其他国家找到相同或相似的产品，对国内市场影响较小。而在中美的农产品贸易中，大豆和棉花扮演着重要的角色。报告显示，中国是美大豆第一大、棉花第二大出口目的地，美国出口的62%大豆、14%棉花均销往中国。据中国海关统计，2016年中国自全球进口大豆8323万吨，其中自美进口3366 万吨，占中国进口总量的40.7%，金额138亿美元。2016年中国自美进口棉花26.4万吨，金额5.1亿美元，进口数量占中国总进口的29.4%。除了大豆，在制造业领域，一些高新技术产品同样使美国占尽优势。报告显示，据中国统计，2016年，美国对华出口飞机440架，金额125亿美元；汽车25.5万辆，金额121亿美元；集成电路97亿美元。中国是美国飞机的第一大出口市场，汽车、集成电路的第二大出口市场，美国出口的约25%的波音飞机、17%汽车、15%集成电路都销往中国。因此，大豆、飞机、汽车、集成电路等产品，被一些人士认为是中国反击美国的“重要武器”。打出“大豆牌”的影响当前中国大豆消费量中约有86%依赖进口，大豆消费较高的对外依存度导致国内大豆价格极易受国际价格波动的影响，大豆进口量的波动也将对国内的大豆供应形成明显的外部冲击。同时国内大豆需求的相对刚性，且库存水平较低，使得供给的边际变化将显著影响大豆的价格走势。中国大豆消费进口依赖度较大，同时需求相对刚性，这将令供给的边际变化导致价格剧烈波动。大豆价格的上涨将显著抬升通胀压力，进而影响央行货币政策操作，此前本公号：CPI超预期上行 将对股市楼市产生深刻影响一文中详细阐述了如果今年通胀上行对楼市、股市的影响，在此不再详细赘述。我国大豆库存水平低自主创新和进口替代迫在眉睫对于粮食进口替代，俄中地区发展投资基金管理公司总经理鲁斯塔姆·捷米尔加利耶夫在莫斯科经济论坛上表示，中国宣布对美国进口食品采取加征关税措施，这将有助于推动俄罗斯成为中国粮食市场的主要供应国。捷米尔加利耶夫还表示，“中粮国际总裁两周前对莫斯科进行了正式访问，并与我方一同与俄农业部长特卡乔夫举行会谈。中粮集团为俄罗斯带来了3个项目投资。”从长期讲，贸易保护可能会促成我国的产业快速升级，以取代美国的技术垄断。中国已是世界自由贸易的宣导者和维护者。从客观讲，短期看美国没有中国的机电产品进口，可以有不少的替代，对美国人的生活和企业生产来说，影响相对较小。但是对于中国在粮食、汽车、飞机领域的关税反制手段，美国的粮农和汽车企业在短期内要承受非常大的压力，损失也会很大。对中国来说，对美国的粮食、汽车、飞机类产品进口增加关税，可替代的选择短期比较难找到替代。对老百姓的生活和企业生产或许会遭受较大大的影响。同时，美国对我国机电产品的关税加征措施，也会对我国的机电类生产企业造成一些负面影响。如果贸易持续进行，中国作为制造业大国天然具有抗通胀能力，而消费大国美国最惧怕的却是猛烈的通胀。（作者：武占国）​点击阅读贸易战系列文章：一：中投公司清空黑石股权 中美贸易战或将全面升级二：中美贸易战最终会伤害谁 潮水退却时美国或才会发现自己是在“裸泳”三：中美贸易战第一回合 人民币升值仅是美国的“开胃小菜”？更多有关贸易战系列文章，请关注本人知乎。"
Harper哈珀,people,,-1,2018-03-23 14:28:47,22,6,2016年大选时早就说了特朗普反自由贸易反全球化，有些人不信，有些知乎白左还论文论证全球化是趋势，不可逆，我趋你％@#&，就好像今年比特币一样，已经跌成狗现在还有人说今年牛市，我牛你#&％@。美国各种资源都不缺，加上几百年的积累，底子厚，关起门来自己搞一点没问题英国脱欧没问题，美国是脱地球没问题现在只要把左派传播普世价值当世界警察价值观打翻，把环保法废了就行有人说特朗普把美国搞成公司，不对，特朗普把美国政府搞成家族企业，临危时刻只有家族靠得住，公司都靠不住，更别说官僚体系。把蒂勒森和Flynn炒了，中期选举红州摇摆州票仓稳住就可以大张旗鼓搞反贸易反全球化了
魔术师帽的兔子,people,默默写作，平稳生活,1,2018-04-05 13:53:49,1,1,以前美国爸爸的惯用手段就是如此，他只是希望你坦坦荡荡喊出那六个字，看看历史日本：爸我永远爱你韩国：爸爸我也爱你台湾：爸爸别抛弃我朝鲜：核弹才是爸爸古巴：我就是不喊爸.加拿大：爸我还听话吧英国：爸我紧跟着你法国：爸你说啥就啥澳大利亚：爸让干啥就干前苏联：你也配当爸爸？俄罗斯：行吧你来当吧.萨达姆：我没来得及喊卡扎菲：我就是不要喊本拉登：你们都不该喊isis：喊你个锤子吧中国：你要战！那便战！
小古,people,,1,2018-04-05 17:17:59,1,0,记得高晓松在晓说还是晓松奇谈里说过，美国不管哪个总统谁敢和中国开贸易战，一次可以，两次可以，敢有三次那些华尔街资本家非把他的眼戳瞎了不可
匿名用户,people,,1,2018-04-04 22:13:16,27,5,美国：坦坦荡荡说出那六个字！日本：爸我永远爱你！（这里说明一下，美国可以影射某人，日本没有比喻的意思，只是单纯地怼而已，各位知友不要误解！）希望大家持续关注此事，让正义终究到来如何看待武汉理工大学研究生陶崇园导师王攀的回应？ http://www.zhihu.com/question/270585819?utm_source=qq&utm_medium=social （分享自知乎网）作者：匿名用户链接：https://www.zhihu.com/question/269538159/answer/358517486来源：知乎著作权归作者所有。商业转载请联系作者获得授权，非商业转载请注明出处。
风雨欲来伤满楼,people,没全力努力过的人不配说放弃。,1,2018-04-04 17:30:05,13,3,造化又常常为庸人设计，以时间的流驶，来洗涤旧迹，仅使留下淡红的血色和微漠的悲哀。在这淡红的血色和微漠的悲哀中，又给人暂得偷生，维持着这似人非人的世界。我不知道这样的世界何时是一个尽头！可是我实在无话可说。我只觉得所住的并非人间。自动化学院研究生学长的血，洋溢在我的周围，使我艰于呼吸视听，那里还能有什么言语？长歌当哭，是必须在痛定之后的。而此后几个校方领导和逝者导师包括辅导员以及学导的阴险的论调，尤使我觉得悲哀。我已经出离愤怒了。我将深味这非人间的浓黑的悲凉；以我的最大哀痛显示于非人间，使它们快意于我的苦痛，就将这作为后死者的菲薄的祭品，奉献于逝者的灵前。鲁迅不愧是中国脊梁，说出的话，写出的文章，在近百年后依然是真理。删热搜，删评论，删微博，忘却的救主快要降临了罢。惨象，已使我目不忍视了；流言，尤使我耳不忍闻。我还有什么话可说呢？我懂得衰亡民族之所以默无声息的缘由了。沉默呵，沉默呵！不在沉默中爆发，就在沉默中灭亡。转载 侵删
赵日天,people,学生,-1,2018-05-11 07:33:21,7,1,看，帝国主义的不平等条约回来了，不过我们这次可以谈它个一两年，边谈边打，打打谈谈。这种毫无诚意的要求不就得拖嘛。现在看情况：美方优势：在中国政府对经济掌控能力长期衰退的背景下，进入改革最容易出问题的时候，他来了，趁你病要你命，用自己经济实力加别的软实力先敲打一下，吸一点点血续自己命，然后打断你产业升级计划。美国继续领导世界最少30年。他现在还是在火力侦查阶段，试探出中国的底线和强硬程度。中国优势：这次美国上下团结一心可以看得出是真的要拼命了。各界人士达成共识一致对中。主流舆论对中国集火，敦促小弟们赶紧断中国财路。但是他再团结，也是可以内部分化的。比如民主党，国也卖过了，还有什么不能卖的？可以专门对准特总集团下的中部农民（大豆）和企业（波音之类的），然后给民主党派系更多好处，让他们再一次放弃国家利益也不是不可能的。还可以部分妥协来满足特总手下人的短期利益（瓦解突厥的套路）全盘接受是不可能的，领导人为自己个人利益着想的话，反而应该强硬
紫金之巅,people,著名屌丝 微信号：Unity3ds,1,2018-04-05 10:15:59,1,2,中已做好打美脸姿势，不知道这次能不能打漂亮点，毕竟人家是美国，美丽的国家，我们是中国，中央之国。
郑雷,people,一个做服装设计，昨天操心国家大事。我是不是犯贱呀。,-1,2018-04-04 12:15:59,5,2,我看只要目的是封锁住未来中国制造的美国市场。目的无非是限制中国高科技的发展。第一：主要是恐吓美国和其他经济体的高科技公司不要到中国投资和技术转让，投资你出口美国要收高关税的。第二：被收关税的行业以后发展，国际融资比较困难。现在还只是关税如果过几年不起作用那就会赤裸裸的禁止了（参考华为）不过也不用惊慌中国本身就是一个大市场
崔秋天,people,左手蛇蝎。心理学管理学哲学历史学经济学,0,2018-03-23 17:17:10,25,5, 22年前：希望平等协商解决，这是不能接受的。22年后：奉陪到底，看谁坚持到最后。美国征税的领域正是我国当前大力发展且前景广阔的高精尖产品，我国中止减税的恰是我们自己不缺，却又引领我们生活向更高层次发展的日常需求品。这样看来，我们的效果会更明显，直接引导消费者转向国内供应商，而美国却变相增加其工薪阶级以及处于发展阶段的小企业的成本。来而不往非礼也，此礼比较简单粗暴。
叶孝麟,people,供应链金融,1,2018-04-12 23:53:25,4,1,再次让我们看清了美国的虚伪和无耻。被逼无奈从低端做起吧，美国人说你血汗工厂没人权。终于有能力去做高端了吧，美国人说你剽窃不尊重知识产权。美国不亏是民主自由的灯塔，照到哪，哪就是黑的。
一只勤快的猪,people,知乎看片指日可待,-1,2018-03-23 13:32:10,111,53,美国:兔子，你不就是新材料，农机装备，工业机器人，新能源汽车，高铁装备，航空产品，生物医疗厉害嘛，从今天起 进我的超市要多交钱。中国:鹰酱，你不就是干水果，水果，坚果，葡萄酒，花旗参，猪肉好吃嘛。但是，从今天起  进我的小卖部还想要优惠，不可能。
知者,people,,-1,2018-04-04 20:57:36,8,2,美国布局亚太很早很早就开始了，这不是政治上的原因，而是经济市场导致的，从日本和韩国的崛起，美国在亚太地区的地位基本就稳了，尤其是在英国退出亚太市场之后。美国经济的强势，不是一句世界工厂能解释的，而是因为美元这个几乎世界通行的利器，货币的稳定以及给全球经济带来的便利，让美国几乎立于不败之地，更别说美国那些财团个个都精明似鬼，拥有一套成熟的投资目光。中国对美国是有极大的依赖，甚至对日本和韩国都有极高的依赖，反过来，他们对中国有多少依赖呢？他们的市场脱离了中国能转动，因为他们有一套成熟的班子，往其他地方一套，就能现用，相反，中国就办不到，这点在中国投资非洲这么多年，就能看出来了。之所以以前中国和其他国家包括美国，双边贸易看起来密不可分，是因为他们都看中了中国这块庞大的人口红利，加上优惠的政策，而不是说没了这块土地，就找不到其他替代的，也不是说离开了中国，他们经济就会崩了。这里面有个更重要的因素，那就是美国在外投资，不是国企，因为没这个概念，他们在金融市场的一切投资，不是以国家意志为导向的。就说代工这件事，实际上在川普上台之前，美国很多在外的企业投资，资金大多都不回他们国内，而是在外独立的，就像在中国的投资，赚的人民币，大多基本就在中国运转，不回美国。正因为这样，美元市场越来越强大，欧元以前意识到了，欧盟也意识到了，只可惜他们没那么高的效率。相反人民币呢？真的贸易战打起来，外汇能有多少，还拿什么像境外投资？毕竟境外很多国家，看着与中国好，实际上最后还是回归到美元上，津巴布韦就是个例子。
陆家嘴市民李先生,people,写对大家有帮助的干货，做对社会有用的铲屎官。,1,2018-04-04 18:06:39,13,19,各位，都冷静冷静。少看点什么“你要战，我便战”“打，奉陪到底”，等一些煽动民族情绪的文章。多去屯点豆油、猪肉、牛肉，才是实事。今天下午消息出来，要加征大豆、汽车、化工品税。乍一看，对我等屁民无关，但事实上关乎你的衣食住行。拿大豆举例：我国大豆70%都是从美国、巴西、阿根廷进口的。现在，消息出来，大豆要加征美国大豆25%的税，也就是增加了中国油厂的进口成本，中国转而要去进口巴西货和阿根廷货。然而，今年阿根廷大旱，几十年一遇的旱情，大豆产量大幅低于预期，有钱都买不到货。中国又只能转向巴西，巴西坐地起价，期货价格和贴水猛涨。但中国油厂能怎么办呢，中国人不能不吃大豆，炒菜不能不放油吧。美国货不敢买，阿根廷没货，只能买价格超高的巴西货。但中国油厂也是商人啊，他们能亏本做生意吗，当然不能。所以，他们进口大豆之后，把大豆压榨成豆油和豆粕，提高两者的销售价格，豆油卖给老百姓用来炒菜，豆粕用来喂猪喂鸡喂鱼，养猪养鸡的成本高了，猪肉、鱼肉、鸡肉的价格也自然高了。这样一来，所有的高成本，全部都被传导到中国老百姓身上。反正，中国人多，征集再高的关税，摊到每个人身上，也少了。所以啊，中国老百姓活的是真糊涂。放一个豆粕期货价格，看着吧，清明节回来，还得涨。
石二,people,,1,2018-04-05 08:49:20,4,0,看到有人说这个金额占美国进口很小，占中国出口更小，实在很单纯。这个事情不是金额大小的问题，而是一旦美国对这些商品收税之后影响到的是中国出口到美国以外的所有国家。试想一下，欧洲采购知道美国对中国收税之后不对中国出口给他的商品压价吗？美国收了高额关税，中国商品就不进去美国市场？肯定要出口给美国，但是因为高额关税，中国产品只能自刀，以政府税收优惠和较低出口价格卖给美国以及其它国家。想到中国对国内高科技产业的减税，不难弄懂针对高附加值的产品出口美国来说，等于是那中国的税收来补美国美国的关税从而想占据发达国家市场。301正式公布起到另一个作用就是资本劝退，中国的的的飞速发展很大程度上依赖大陆外资本。一旦国际资本甚至是国内资本知道自己投资的中国大陆的高科技产业会以地狱模式进入美国市场的话，肯定想着企业的融资困难和资本市场寒冬将至从而想着如何退出。其实国家最近在a股绿色通道或是将要退出的注册制，甚至是港股发行制度的一些新的修订都是对冲这个利空从而想让一级市场不产生强烈波动，加速产业转型。但是总想着如何发展高科技产业，却忽视高科技产业之所以能有那么高的附加值是因为它的稀缺性，这个蛋糕就这么大而且很大一部分都是欧美发达地区市场，收税后再想以低价的方式和欧美的高科技产业抢夺这个市场显然很困难了。说了这么多，国家会以何种方式去发展这些被美国针对的高科技产业呢？这面临保大保小的问题，有潜力的企业会得到政策扶持并代表中国先进制造和高科技创新进入全球市场，这样的企业在一个行业恐怕不超过两个，剩余的企业要么破产，有点背景的通过接这些行业龙头的单苟活，注册制之后扔到a股融资质押后让其债务不殃及银行系统就好。
匿名用户,people,,1,2018-04-05 13:40:22,20,3,个人认为这里面有王攀的水军打倒钩狼，一开始大家都挺冷静借借热搜什么的挺好，后来突然开始去高票下带节奏，去反对回答里面带节奏，主动挑事搞得两拨人自己先对骂起来了。
莫失莫忘,people,中规中矩,1,2018-03-23 17:40:03,18,6,针对高票回答的图，我换个思维方式：因为高技术装备美国都可以自己造，所以美国禁了，且农产品可自产。而中国农产品不足，且高技术装备必需依靠美国所以不能加税？
菠菜苗321,people,,-1,2018-04-05 09:36:18,106,122,中国房价十几年涨了十几倍，工资一倍都涨不到，一汽，长安等吸血鬼国企拿着大众，福特中国百分之51的股权，贪污腐败，和外资一起压榨中国工人，搞的中国产的奥迪比德国产的还贵，少部分权贵中饱私囊，至中国消费者利益不顾。美其名曰政策是为了获得先进技术，结果最后还是靠民营车企自主研发。美国制裁中国，逼着中国改革，难道不是好事吗？是我傻，还是知乎都是权贵的代言人？
分享的小蚂蚁,people,设计师,-1,2018-04-04 12:37:41,15,1,http://www.bilibili.com/video/av9430900，毛主席关于抗美援朝演讲，放在今天依旧真理，贸易战打多久，不是我们决定的，而是由特朗普决定的，他们要打多久，我们就打多久，，中国人民不屈不挠的意志必将稳步地达到自己的目的，
kevin,people,工程师,-1,2018-03-24 12:57:16,7,0,川普打击我们国家10个领域是：先进信息技术产品；自动化机床和机器人；航空航天装备；海洋工程装备；现代轨道交通装备；电动和其他“新能源”车辆；电力装备；农业机械装备；新材料；生物医药和其他高性能医疗器械。这几乎就是照抄中国制造2025计划的重点发展领域计划报告。所以美国对中国贸易战只是幌子，目的是打乱中国现代化进程和部署，遏制中国的崛起。这次贸易战避不开躲不了，是美国保护自己世界第一的本能反应，现在如果不制裁中国，十年后就没有能力再制裁中国。
杰伦的小迷妹,people,最喜欢读别人的一句话描述,0,2018-04-06 09:51:19,3,0,已经1000亿了可能特朗普认为5号增加500亿中国政府过节去了？？？我想等今天下午即将出台的又一反贸政策我觉得越来越刺激了
