name,type,headline,gender,created_time,vote,comment,content
超级淡水鱼,people,,1,2018-03-25 12:02:55,72,37,美国宣布对中国征收关税意味着中美贸易战的正式开始，美国开始全面执行贸易保护政策。关于美国转向贸易保护的必然性和中美贸易战争的本质的更多相关分析，请参看以下文章：超级淡水鱼：谈中美贸易战争超级淡水鱼：谈中美贸易战争2之贸易战争的本质同时这件事也意味着美国最终彻底放弃了自己亲手构建的WTO贸易架构。从此，WTO名存实亡，以后各国贸易争端将不再会有一个全球性的协调机制，各国又回到了拉帮结派的战国时代了。由于美国目前是强迫所有西方工业国对中国展开联合贸易战争，而欧盟日韩等国直接受到美国的军事控制，基本是没有任何拒绝权利的。所以中国必须放弃所有幻想，立即和其他友好国家正式建立属于自己的贸易同盟，才能进行有效应对。
李湖居士,people,坡老门下小卒/襄阳迷途书童,1,2018-04-05 16:21:18,11,0,这是美国人无理取闹，我国公布的反制措施纯粹是来而不往非礼也。特朗普此次挑起中美贸易战，直接目的在于以中美贸易严重失衡迫使中国进一步对美开放市场，深层次目的在于试图重演1980年代美日贸易战以遏制中国复兴，同时在11月美国国会中期选举前拉票。但是中美贸易严重失衡责任不在中国，主要原因在于美元国际储备货币地位、美国过度消费的低储蓄模式、全球价值链分工以及美国对华高新技术出口限制等。中美贸易战开打势必增加美国民众生活成本，推升通胀，制约消费，给全球经济复苏蒙上阴影。
努放的小小鸟V,people,自己选的路，滚着也要滚过去-Weibo,1,2018-04-04 21:55:27,67,9,美国：坦坦荡荡说出那六个字！日本：爸我永远爱你！（这里说明一下，美国可以影射某人，日本没有比喻的意思，只是单纯地怼而已，各位知友不要误解！）希望大家持续关注此事，让正义终究到来如何看待武汉理工大学研究生陶崇园导师王攀的回应？ http://www.zhihu.com/question/270585819?utm_source=qq&utm_medium=social （分享自知乎网）粘贴复制过来的我觉得咱们也可以去给傻乎的后台问一下什么叫zhengzhimingan的问题
阿野幸,people,,1,2018-03-24 13:10:47,76,25,我们不惧任何国家的贸易战，谁先发动都将奉陪到底！但要警惕特朗普采取下三滥手段，公布一些我国高级干部的潜伏在美的亲属的国籍、财产情况，特别要防止他造谣中伤。如果有这类消息传入国内，我们不要相信，一切以新闻联播、人民日报。光明日报，参考消息，新军事报，环球时报，求是杂志为准！！
陈磊,people,君子惠而不费、劳而不怨、欲而不贪、泰而不骄、威而不猛。,1,2018-04-05 14:54:27,38,11,2009年之前拉动中国经济的三架马车：出口、投资、消费。其中出口占比60%以上（凭记忆，错了记指正。）然后2009年美国金融危机，影响了全世界。中国GDP增长率从2008年的18.2%降到9.3%，工厂倒闭一片，哀鸿遍野。然后，2010年GDP增长18.3%，2011年18.5%。再后来，GDP降速到直现在百分之六点几。中国经济受其他因素和外国影响，有，但是有限。金融危机也就是那么回事。但是，中国经济发展与其他任何国家不同，中国经济是双引擎：企业和政府。在之前，各地政府领导都是和《人民的名义》里达康书记一样，追求GDP。在之后，其中一个引擎“政府”关机了，所以GDP增速应声而落。政府是脸好看、声好听、事儿不办。（以上观点引自金政委）中国的经济问题或者说任何问题，都不仅仅是经济问题或其他问题，而是政治问题。至于国内企业的影响力多大，王健林演讲的靓影大家多久没见了？马云最近是不是安静了很多？现在，政局已经稳定，关系已经理顺，“政府”这个引擎应该要重新启动了。所以，美国的这些手段，包括之后可能再有的加码，不过是一把锤子，把中国经济的杂质淬炼掉，让经济实力更凝练而已。中国经济最终还是看中国自己。
BgGG,people,只看，肾炎,0,2018-05-29 23:15:31,10,0,2018  05   29  ，最新消息 500亿美元规模加征25％关税又来了，这次难道还放空炮吗？5.28侠客岛发文方放言 可以斗一斗，当时不明所指，现在看了就在这了。真正升级的贸易战，肯定会对2025有很大影响。我们可以让步但绝不会停止2025，停下来了，妥协了，无疑自废武功。
ying,people,遥望长空，逆转一生天数,-1,2018-04-04 11:42:50,164,56,"还能怎么看，该来的总会要来的，美国对中国经济环境的不满意又不是一天两天啦，这次加收重税也是意料之中的事。特朗普对中国政策的核心就是要平衡30多年来累积的多达4.3万亿美元的贸易逆差，最终目的是逼使中国的“第二次对外开放”。中国的钢铁产业首当其冲成为主要目标。对美钢铁出口虽然排在前十名以外，但许多第三国家采购中国的钢铁再将制成品出口到美国，中国钢铁通过“转运”的方式到达美国，实际数量和份额远超表面的统计数据。而这部分“转运”到美国的中国钢铁将受到国钢铁关税的直接影响，这又反过来影响中国钢铁出口到第三国，也将进一步加大中国钢铁的产能过剩。美国方面也表示，对于关税的豁免，中国是唯一一个不会出现在豁免名单上的国家。这已经摆明了态度，贸易战已经正式开始，由不得你说不愿意。不过中国自然也不会“挨打不还手”，我不想打贸易战，所以打不打取决于你，但如果真的打起来，要怎么打，可不会按照你的思路来走了。中国前段时间宣布对美国出口的七大类产品也增收关税，这也算是双方的第一次正式“交锋”，也意味着这场没有硝烟的战争，已经正式拉开序幕。其实不仅中国，美国的不少“盟友”也曾经被特朗普用贸易战的手段“削”过。他之所以敢同时对加拿大、墨西哥、中国、日本、韩国、澳大利亚和全部欧盟国家进行贸易战，绝非心血来潮或者头脑发热，而是基于一个最基本的事实，即美国富饶的自然资源和科技高度发达的生产力，可以使美国不依赖于任何一个经济体也能独自生活得很好。即使美国脱离了一个经济体的进口来源，马上也会有其他经济体求之不得并迅速替补；但是其他任何经济体都高度依赖于美国这个巨大的市场，一旦脱离了美国这个市场，其经济将迅速衰退。这就是特朗普敢于对上述所有国家同时进行贸易战的底气和根本原因之所在。特朗普为什么铁了心要和中国打一场贸易战？其原因还是用数据来说话。中美贸易，根据美国商务部的统计，从1985年美方开始出现6亿美元的逆差，1995年美方逆差为337亿美元，2005年上升到2022亿美元，2015年美方贸易逆差达到惊人的3671亿美元，2016美方贸易逆差3470亿美元，2017年美方贸易逆差达到3752亿美元,创历史新高。从1985年到2017年，美国对中国的贸易逆差总数为47380亿美元。美国对中国持续开闸放水30多年，47380亿美元的贸易逆差，特朗普认为这是美国当今最大的“政治不正确”。因此。中美贸易问题是当今中美关系的核心问题。说到底就一个字，钱。给了钱，啥都好说。虽然说谈钱伤感情，但没有钱，连感情也没得谈了。不过我倒不担心第一和第二大经济体能发生多大规模的“撕逼”，因为这对双方都没好处。我更担心的是，C919大型客机会不会成为这次贸易战的牺牲品。要知道中国对C919投入的精力、财力和重视程度，可不是那点钢材税能相比的，能不能让C919打入国际市场，还得看美国肯不肯发FAA适航证。如果美国借此在这里卡脖子，没准C919就真的会黄了，到头来只能在国内或者非洲国家使用，从而丢失掉国际大市场。最后，我相信我们国家一定会有办法，在这场贸易战中旗开得胜！https://www.zhihu.com/video/964829630818131968"
叫我官人醉月,people,Carpe diem.,1,2018-04-05 13:56:25,79,8,对于这个回答，三张表情包说明这个问题。
冬泳健将钱谦益,people,公众号：hongxiuqingshan,0,2018-03-23 12:08:56,91,18,首先写给国内所有的川普粉不要以为大统领会同老女人不同，就算他真的同老女人不同，但是他坐到大统领的位置，决定了他必然以美国利益最大化为出发点。本质上川普、老女人他们是一样的。所以，归根结底，那就是：帝国主义亡我之心不死消除幻想，准备斗争吧，斗争求得生存，斗争求得壮大。还记得上个世纪九十年代时，、美国为首的西方屡屡对中国进行制裁及贸易战，动辄威胁取消中国贸易最惠国待遇，然而那个时候，我们只能空嚷：建议对米帝某某某产品进行反制裁。。然并卵，人家才不Care你。进入二十一世纪，今非昔比了。这种大家互相伤害的事，10年前TG不怕，现在，就更不畏惧了。既然要来，那就来得更猛烈些吧。波音、英特尔、高通什么的，大家一块过苦日子吧。。。等等看一下大统领签署的对中国征税领域及中国的反击商品目录这分明是一个农业国家向一个工业国家发起贸易战嘛。米帝红脖子农民伯伯们，你们安好？
木木,people,,1,2018-04-06 05:36:10,11,0,经常被新闻里提及的中华民族的伟大复兴，不单是什么GDP世界第一，又下水了几艘航母，又发射了几颗卫星，而是重新让天朝上国再次成为褒义词，也就是国家影响力世界第一下面说正题世界资源就这么多，消化各种产品的能力也有限，国与国之间的货币往来又全凭政府之间信任才能兑现因此如何控制本国的通货膨胀以及在国际贸易中让本国利益最大化也就成为了货币政策的基本课题，那么贸易战也只不过是货币政策下的一个小摩擦而已用目前我国的政策来说就是降杠杆和人民币走出去既然人民币要走出去，需要什么？黄金还是石油？都不是，是国际影响力眼下欧盟内乱，美国国内各阶层之间矛盾激化，俄罗斯内外交困，石油价格走低，世界金融危机尚未度过，不在这个时候提高人民币的影响力，不在这个时候挑起反美旗帜，更待何时？因此这场贸易战不管对面的总统是观海，还是希拉里，特朗普，只要到了这个时点必然爆发，所以不要觉得这只是特朗普的一时兴起，不要觉得我国只是被动反制，不要觉得战争会很快平息，一切都才刚刚开始，而这一点，双方政府心知肚明那么贸易战的结局会是我国大获全胜吗？当然不会，共和国还年轻，还需要时间，在接下来的谈判和磋商中或许还会给美国台阶下，但是反美大哥的旗帜已经从苏联，俄罗斯的手中传递到了中国，反美一哥已经当之无愧了反美或许不是提升国际影响力的唯一方法，但却是成为世界第一的必经之路！今后十到二十年的世界格局一定是中美逐鹿，他国站队的局面，但是经过特朗普这个卧底的暗中协助，西方社会那些高福利低储蓄的国家会选择贸易保护还是自由贸易，会选择萎缩的市场还是新兴的世界还用说吗？那个时候人民币真正的走出去，成为石油货币，黄金货币，信用货币，美元的坚挺还存在吗？身为债主的中国到时候如果大幅度减持美债，美国……会怎样？画面太美，我是不敢想我国目前国内大力推行的一带一路就是为了去库存，使人民币国际化，因此需要强大的海军力量和空军力量来保证政策的实施，为了爱之省湾湾而造航母？不存在的而推行的产业升级，中国制造2025，以及二胎政策和外籍人员落户政策是为了应对接下来的人口老龄化劳动力不足以及GDP过度依赖房地产的问题，因此需要更多的专业技术人才和更全面的教育体制，响应民众呼声而减负而高考改革？不存在的而目前的高铁建设从近处说是为了提高GDP给产业升级赢得时间，保证就业率，从远处说保证了国内统治力量触角的敏锐和稳固，所以说为了民众出行便利，为了缓解春运压力也是不存在的说这么多有的没的就是想说明一点，我国的政策是连贯而且目的非常明确的，世界上也没有任何一个政党会对自己的国家负有如此大的统治力和责任心，因此贸易战也好，汇率波动也好，甚至战争也好，我国都带有天然的优势，把目光放远，贸易战只是前菜，甜点才是我们想吃的最后做个小预测吧，基于特朗普政府如此给力的考量，我猜上海合作组织的成员国在五年之内怕是会有第二个欧洲国家加入了，那个时候再来看此时的胡言乱语吧
王田通,people,配图小能手,-1,2018-04-05 00:01:26,2,0,川普疑似动摇！！！在中国于中国时间4月4日发布公告称，经国务院批准，国务院关税税则委员会决定对原产于美国的大豆、汽车、化工品等14类106项商品加征25%的关税。实施日期将视美国政府对我商品加征关税实施情况，由国务院关税税则委员会另行公布。美国时间4月4日（美国比我们晚13个小时），川普发两条推文。推文一翻译：“我们没和中国打贸易战，这场战争多年前就被当时代表美国的那些无能的蠢货人打输了。现在我们一年有5000亿美元的贸易逆差，另有3000亿美元知识产权被窃。我们不能让这种情况继续下去！”推文二翻译上有两种不同的说法，我直接上图翻译1、当你下了五千亿的注，你绝不能输。翻译2、当你输了五千亿，你就没什么好输了（啥也不怕了）。推文中否认了正在打贸易战，短短几十个词的推文，推卸责任给前几任，叫苦，叫嚣都包含进去了；但最关键的，川普把现在这些措施定性为给一场失败了的贸易战找补残局！大有不求全胜，破罐破摔，能补一子是一子的意思。看来国家这次出手疗效显著中华民族几千年玩下来了还怕你不成？
