name,type,headline,gender,created_time,vote,comment,content
贝尔门,people,江湖郎中的大仙,0,2018-04-04 18:53:16,1,1,客观上说，从1983年以来，美国一直都面临贸易逆差的问题。并且贸易逆差最大的来源国就是中国。美国的这种反应是应该有的，可是我们国家也在积极的解决。比如开启新丝绸之路，把贸易额导向其他的国家。缓解美国和其它发达国家的压力，我们作出的努力是有目共睹的。我们与美国有很多共同的商业资产。一旦受损对美国的影响也是很大的。
秋平499,people,微微一笑，假装开玩笑～,-1,2018-04-04 18:41:52,1,0,这次贸易战，政治原因很重要，经济原因只是导火索。特朗普会有特朗普的风格，你们想咋样他就咋样，他不是很没面子～？
小贰神,people,好吃懒做,-1,2018-04-04 18:31:25,1,3,我主要对大豆这一块比较担心。很多人说我们不缺大豆。确实，我们不缺大豆，但是缺豆渣！！大豆油有很多替代品，但是豆渣没有！！大豆不稀有，稀有的是大豆产生的豆渣。豆渣能让猪张的更好，成本更低。没了豆渣，猪肉要涨价。对普通百姓影响太大。我们在城市里，猪肉涨几块甚至十几块，影响不是很多。至少可以承受。但是对于小镇甚至是农村里的人来说。影响太大了。当然，打战不可能对自己毫发无损。但是我更希望是承压能力更强的经济收入中上层阶级来承担。
zlalien,people,药品研发,-1,2018-04-04 18:26:03,1,3,村里原来老大最狠，老二给老大打工致富了，老大一看不对，要敲打一下老二。老二说，我赚你钱不假，但赚别人钱也不少啊？而且我赚了钱就买你家债券，你也不吃亏。老大一想是这个道理，奈何话已经喊出来了，也想趁机薅羊毛，脸一沉说：咱俩怎么也要打一架。结果，原来吃瓜的其他村民莫名其妙挨了一堆石子板砖，老大老二一起说，对不住啊，误伤、误伤，我们不打了，大家一起建设村子。以后老大老二还是隔段时间打一架，越打，村民们越穷越受伤，老大老二多少都能落点好处。这架谁不爱打啊！
白苏,people,医生,1,2018-04-04 18:09:14,1,1,     中国已经开始着手对美国大豆 ，汽车下手了！！！！！http://weixin.qq.com/r/1nVfRznEGmRlrX0k9yDE (二维码自动识别)
月亮同学,people,设计师 预订艺术家,-1,2018-04-04 18:08:06,1,0,两个人打架要都伸出拳头，才有谈判的余地，要在众目睽睽之下俩人撸起袖子，“我他妈打死你” “你来啊谁怕谁”，这样打架才有劝阻的可能，要不然一边服软了就是旁边的人劝“别打了”，另一方只会说“别她妈拦着我”然后仍然挥舞自己的拳头
来自废墟,people,一句话,-1,2018-04-04 18:04:32,1,1,我们需要记得，这是一场帝国主义强加给我们的战争。我们没得选择，我们现在做的一切，都只是为了维护自己的正当利益。仅此而已。
Diao Bro,people,,0,2018-04-04 17:43:07,1,1,知乎里的高级知识分子悠哉。
一缠散人,people,人散神不散,1,2018-04-04 17:21:11,1,0,用嘴炮操控市场牟利，是政治家捞好处的新方法，这比写书、搞基金会什么的来钱块多了我怀疑特朗普背后在和金融大佬做盘，提前把消息透露给大佬，这样就能在金融市场的波动里赚钱了，外汇、股市里背后赚钱，比搞房产快多了。    一天一个利空，一天一个利好，割全世界的韭菜，割完多头割空头。水越混，他赚得越多，所以一天到晚怼这个，怼那个比如他可以让人先卖空亚马逊，然后只要推特上骂几句，亚马逊就大跌了他就是折腾，他一折腾，各个贸易协会就得出来游说，他又能捞一笔
木不,people,,1,2018-04-04 16:31:15,1,0,关于贸易战，有贸易逆差、美元石油体系的原因。本质上还是目前有限的资源下，如何分配的不可协调矛盾。如果形势继续蔓延下去，势必形成新冷战。根据课本说：更深层的原因，还是因为生产力未能极大提高。同样二者又是相辅相成的。资源有限，导致激烈竞争，激烈竞争又推动了生产力发展。从而形成新的平衡。
zlf,people,,-1,2018-04-04 16:27:08,1,0,修昔底德陷阱在经贸领域的体现
Kavin,people,商业安全,-1,2018-04-04 16:21:16,1,0,反击了  反击了  大豆  飞机  汽车  。。。。500亿美金   你们说的都在  就一个字 干  狭路相逢勇者胜
TaoHinching,people,,-1,2018-04-04 16:14:21,1,5,中国太被动了按照美国人的贸易保护标准应该对美国转基因大豆征收惩罚性关税，禁止其跨国公司摧毁式的倾销和垄断产业链，同时补偿中国豆农十年损失共计5800亿美元。
一直学习一直爽,people,不自是，故彰,1,2018-04-04 15:59:28,1,2,最新消息      重拳回击！中国拟对美大豆、汽车等商品加征关税说吧，什么时候砸车  0.0
master,people,机械，作家，电子音乐，剪辑，电子竞技，硬件,-1,2018-04-04 14:36:10,1,6,我不想多说什么。我只想让大家想想特朗普限制政策提出来的时候，中国北京刚发生了一件什么事。这是巧合吗？至少我不这么认为，反正美国是怕中国了，只能说这件事比中国制造对美国来说还麻烦Ծ‸Ծ
苟且,people,,-1,2018-04-04 11:51:44,1,2,别上当，美国的这次根本不是贸易保护，是技术隔绝，特朗普的这次清单都是中国的高科技萌芽阶段的产业，美国这样做事试图引起中国在高科技方面的报复，这样中美高技术交流就停止了，美国就能保持继续的高科技领先，美国的真实目的就是隔断高科技流向中国，我们不要在乎这500亿，应该敞开国门让美国高技术产业和商品流入国内，刺激国内高科技的发展。
河畔少年,people,,-1,2018-04-03 09:07:23,1,0,个人观点:以商人的思维去解决政治问题，本身就缺少可行性，商人的大局观相比于活跃的政治人物的还是差点！只能说一个傻子看不得一个孩子变得越来越越优秀，耍小聪明而已，他却不知道原来这个孩子进了学校之后有了很多很好的朋友！谢谢
木子,people,外汇交流招商Q:1664199775,-1,2018-03-26 09:38:16,1,0,任何一个国家征收关税都是为了保护本国的经济，如果贸易赤字大了，无疑是对他国的依赖性很强，不利于一个国家的正常发展，关税征收从一定程度上可以减少进口额，从而购买国内产品，从而促进国内制造业，重工业，轻工业等的发展，所以，一定程度上的关税征收是美国的一项贸易保护措施。
何昊森,people,精稽学/折学/哩史/嘤文诗,1,2018-03-25 22:28:42,1,0,从美国的角度答一波:如图，美国对中国商品加征关税意味着美国进口减少，净出口增加，这使得外汇市场上对美元供给减少，迫使均衡汇率提高。汇率的提高又使得美国的出口商品价格提高，从而减少了外国消费者对美国商品的购买。最终，净出口维持不变，国民收入也不变，只不过那些应该被淘汰的产业得以在贸易保护主义的大伞下苟延残喘，而以出口为导向的高新技术产业遭到不利冲击。你问川总统想干嘛?川总统也不傻，人家就是为了努力阻止某朝制造2025成为现实。诶，打字打到这，我想到这玩意儿可以用博弈论谈一谈，改天等我有时间了再更吧～
庄严,people,职员,-1,2018-03-25 18:58:52,1,9,关键一招还没使，抛售美国国债，箭只有引而不发才有威摄力，不用怕，会和平解决的，其实也没啥，中国进口美国产品的税率本就比美国进口中国的高，提一点也合理
彭文韬,people,玫瑰,1,2018-03-24 10:06:25,1,0,后续影响当然是开动宣传机器，营造美国 的良好舆论氛围啊。
匿名用户,people,,1,2018-04-04 19:26:25,2,2,感(❁´ω`❁)谢老美的神助攻！在大部分人因为国内日益增长的70年住宅所有权价格、日益增长的课外补课费与择校费用、神奇通涨率而产生一些别样的小情绪的时候，国外矛盾来了哈哈哈中国  求之不得！让大部分人将本来focus在环境污染对癌症发病率的影响、70年后房屋产权归属问题、阶层上升通道不断减少的现状转变到国际矛盾，这是国家机器前进的润滑剂与粘合剂。这一“战”，作为国家机器，所有人，特别是楼上这些，异常欢喜。
无弃权,people,,-1,2018-04-04 17:50:37,2,2,2016年，欧美日等国家相继不承认中国市场经济的地位，至于为什么不承认，知道的人自然知道，不知道的多看一些新闻；2018年，以美国为代表对中国进行贸易战，至于为什么会这样，看看川普在白宫签字前的那段话你就大概知道了。
夜游神,people,历史爱好者,-1,2018-03-26 14:29:39,2,0,体制不同，顾忌各异。特朗普政府征税项目针对中国未来重点发展的高科技产业，扼制外资在华投资，意在压制中国崛起，此为一。通过贸易战直接打击中国外汇储备，动摇人民币根本，此为二。借机敲打欧盟日韩，巩固其老大地位，此为三。中国近年大搞军扩，和平发展五项原则已近抛之脑后，海外驻军，一带一路，国家统一的呼声高涨，民族主义日渐抬头，引别国警觉，亦是人之常情。特朗普上台即退出奥巴马运筹多年的tpp，苏秦六国合纵锁秦大计落空，自废武功。以中国的体量只需设法拉动内需便可抵消出口疲软的缺口，此时需要智囊慎行之，为企业松绑，减免税收，增加收入，加强社会保障，则内需强，内需旺盛则自强。如一意孤行，以个人意志凌驾国家利益则落入圈套。08年有一次转型机会，现在也许又是一个机会。
wuweilxl,people,欲将心事付瑶琴，知音少，弦断有谁听。,1,2018-03-26 01:30:58,2,0,中美关系与重商主义村长前面写过中美贸易，中国一方面承诺美国能源产品更多的进入中国，另外一方面中国要把美国能源产品作为最主要的制裁目标，因为美国能源输出中国，增长最快。美国贸易制裁中国，无非就是重商主义翻版。其实美国人减少美国人的税，中国人也减少美国人的税。中国会加大向国内征税的力度，然后补贴出口美国的企业。不是有个梗，讲的是：美国人可以查美国总统的收入，中国人也可以啊……关于有关部门的放开金融领域准入，一方面达不到美国的预期诉求，另外一方面对中国经济也是严重的威胁。而对于能源方面，进口沙特的石油和进口美国的石油，进口澳大利亚的煤炭和进口美国的煤炭，并无区别。这就叫死道友，不死贫道（牺牲小国利益，作为大国之间交换的筹码）。中美贸易战曾国藩：贸易战这个主要怪中国，中国一直对美国产品征收高额关税，美国企业也很难进入中国。脚跟净村：@曾国藩  就是，你看看杨白劳把黄世仁逼的。美国人加关税，进来一个收一个税。北辰：@脚跟净村  这特么都不是一个个体量。美帝对咱们是致命的，咱们的制裁对人无关痛痒。初容：@北辰  网上都说农业大国向工业大国发起了贸易战。咸鱼王：禁运老干妈，饿死丫的，这叫自损八百，可伤敌一千。中国不让谷歌脸书进入中国   苹果、汽车也都高关税，不也没咋滴。闭关锁国，还不知道谁离不开谁呢。蛆友会：要准备过几年苦日子了。脚跟净村：新华社华盛顿３月２２日电（记者江宇娟　孙丁）美国白宫２２日发表声明说，将暂时豁免对欧盟、阿根廷、澳大利亚、巴西、加拿大、墨西哥、韩国等经济体的钢铝关税。3月23日，美国海军“马斯廷”号导弹驱逐舰擅自进入中国南海有关岛礁邻近海域。中国海军570舰、514舰迅即行动，依法依规对美舰进行识别查证，并予以警告驱离。美国急眼了。曾国藩：2017年中国向美国出口五千多亿美元，美国向中国出口一千多亿美元，中方顺差三千多亿，谁居贸易战优势一目了然。比中国更便宜的货源有的是。印度人口13.4亿，孟加拉1.6亿，印尼2.6亿，越南近1亿。总共十六亿多人。这些国家劳工成本都低于中国，也早就开始从中国手里抢欧美订单。这些年北美市场上的大众化衣服帽鞋和一般日用品正逐渐被这些国家产品所取代。富士康等台商港商以及日美制造企业也开始向这些国家迁移。最重要的是，这几国不会受到301条款制裁。因此，这些国家的产品将能替代很大一部分中国产品。一旦中国产品被征高关税，这些国家的产品肯定会蜂拥而上争抢美国市场的中国份额。而一旦他们站稳北美市场后，中国产品想再恢复已是难上加难。中国对美国的顺差今后一两年内至少要减少1/3，也就是至少要从3千5百亿美元降到2千5百亿美元，也就是说中国每年至少对美还有2千5百亿美元的顺差。猫真神：@曾国藩  中国海军炮轰关岛，特朗普屈膝求和，双方在夏威夷签署和约，决定美国关税由中美协商决定。咸鱼王：冲锋电风扇，不服就是干，输了下海干活。见苟十二撸：中国是一头睡着的雄狮，不打一下不会醒，醒了又睡回笼觉。脚跟净村：据日媒报道，日本政府3月23日在内阁会议上决定对中国和韩国产的部分钢铁产品征收反倾销关税。征税对象为碳钢焊接接头，3月31日起征，为期5年，税率为41.8-69.2%。日本政府将于30日正式公布政令。村长迷弟： @易行道 村长 讲讲中美贸易战吧。易行道：@村长迷弟  在一群讲吧。老干爹早就看透了这一切。https://mp.weixin.qq.com/s?__biz=MzI1NzEyOTU2NQ==&mid=2653022502&idx=1&sn=873f8713ab9932f86764da9743de6e77&chksm=f1c96414c6beed0205e1cafaeda78fa14ef5808cc09e343a3eaf54d3be4ddabc43a785b96f81#rdhttps://mp.weixin.qq.com/s?__biz=MzI1NzEyOTU2NQ==&mid=2653022488&idx=1&sn=1befdb95d2dce475d8e5396866444805&chksm=f1c9642ac6beed3c528a4a8475046f3f7dfc2110a76da190887fe91d32f93dcc196ba5d0415e#rdhttps://mp.weixin.qq.com/s?__biz=MzI1NzEyOTU2NQ==&mid=2653022474&idx=1&sn=c913165e5d9650a3d3e9c36c20487ce1&chksm=f1c96438c6beed2ed0d02adc763efe57fb36bc75b21e96aa9a2eb29a75afa9f34127eb76257a#rd中国和美国之间最大的问题就是战略误判。狗认为自己举手是想示好，而猫认为这是示威。猫发出呜呜的低声是表示自己很高兴，而狗只有在受到威胁准备反击时才会发出这样的声音。狗喜欢摇尾巴表示善意，而猫认为这是没事找抽。冰冻三尺非一日之寒，中美之间的战略误判已经到达了双方都不能信任对方的地步。有一种阴谋论，说某某某在香港变节，后到达莫斯科，于是作为交换把美国一干要员的信息出卖给普金。普金在美国大选中低价卖给了重返亚太的对手，殊不知新自由主义的对手保守主义更加注重意识形态领域的战争。人类一思考，上帝就想笑，这就是今天尴尬的局面。美国商务部部长说：美国希望中国进口他的天然气。然后我就哈哈哈一笑。18年初中美贸易战现状：2018年1月，特朗普政府宣布“对进口大型洗衣机和光伏产品分别采取为期4年和3年的全球保障措施，并分别征收最高税率达30%和50%的关税”。2018年2月，特朗普政府宣布“对进口中国的铸铁污水管道配件征收109.95%的反倾销关税”。3月9日，特朗普正式签署关税发令，“对进口钢铁和铝分别征收25%和10%的关税”。2月27日，美国商务部宣布“对中国铝箔产品厂商征收48.64%至106.09%的反倾销税，以及17.14%至80.97%的反补贴税”。3月22日，特朗普政府宣布“因知识产权侵权问题对中国商品征收500亿美元关税，并实施投资限制”。美国的唐纳德他是保守主义，保守主义对外部势力是极端仇视的。在伊朗，在阿富汗，保守主义无数次向苏联白熊发出挑衅。在国家层面，美国决不可能作视一个国家的崛起，曾经美国成为世界第一的时候，他第一个消灭的就是世界老二法兰西。消灭完法兰西，美国马不停蹄的开始肢解大英帝国。为什么肢解大英帝国？因为当时的大英帝国是比苏联领土面积更大的世界第二帝国。反观不可一世的大英帝国，他已经没有当年宣纳粹德国的豪情。肢解完大英帝国，美国的目光就开始瞄向苏联，苏联在此前一直是美国响当当的盟友，没有苏联的支持和帮助，美国根本干不翻英法联盟的老欧洲。但国家之间就是这样黎塞留的天主教法国和新教瑞典国家，甚至奥斯曼帝国结盟都毫无障碍，那怕是针对和自己一个战壕的天主教国家神圣罗马。肢解完苏联，美国笑呵呵的看着日本，日本惹谁了，日本是美国标准的占领地，但这并不妨碍美国打断日本经济发展的腿。成也萧何败萧何，日本的经济效率全世界最高，这是事实，但还是村长讲的那个故事，凭什么日本汽车可以畅通无阻的在日本销售?唯一合理的解释就是日本在汇率上做了文章。日本靠日元汇率崛起，美国就拿日元汇率做文章。美国只是逼迫日元升值，不断的向日本施加压力。还有德国，但德国通过欧盟物质代偿，逃过一劫。日本最后勉强同意自己盟友提出的这个看似合理的建议，结果就是美国抓住日本的小辫子，玩到了今天。你们很难理解安倍三只箭，其实很简单，就是日元想贬值突破压力位，你想美国怎么可能让你重新掌握主动权。今天，中国超越日本成为世界第二。美国先是以G2相诱，现又以贸易战争开局。中美经济之间最大的问题就是货币资源的问题。历史上中国就是贫金、凭银国，所以中国的经济发展势必以获得金银为第一目的。时间推到现在，中国的货币之锚就是美元，中国用锚定美元的办法开始刷人民币，这个办法其实当年的孔祥熙用过，那就是我不抛美元，那我的金圆券就一直有锚可用。只要有这支锚在，金圆券他就是有价值货币，你别说这的确是个办法。到了宋子文，他认为民国应该恢复货币信用，然后他就抛出了黄金、白银、美元，最终导致局面崩坏。今天中美贸易战，其核心都不是钢铁和铝材，大不了我们继续供给侧改革不就结了，问题的核心在我们如何继续获取美元。假如中国不能保持稳定的现金流，中国将会出现孔祥熙时代恶性通胀。假如中国抛出美元、黄金，中国将会出现宋子文时代的风雨飘摇。当然我想我们的央妈，不会出现这样的低级错误。问题的核心是中国如何继续出口商品换取美元？出口什么商品？还有就是外部环境对中国经济的连锁反应。一方面是中国经济下行，导致的进口减少，其中包括原材料、石油、矿石等价格的大幅下跌，这也是美国加息想要的目的。另外一方面是欧洲、日本、澳大利亚、印度、巴西这些蠢猪国家，会争相对中国进行贸易制裁。首先，从08年开始至今，美国的首要目的就是打爆世界经济。现在问题的核心就是谁是那只为世界经济献祭的猪，你们还记得村长写的欧盟、希腊吧。经过这些年的整合，欧盟的经济已经有了长足的发展，而且势头直逼美国，当年村长的想法就是中国经济扮演一只盘旋在欧盟上的秃鹫。（知乎可见）虽然样子不好看，但是有肉吃啊。今天日本的三只箭射完了，日本的负利率已经到位。欧盟已经走出了最困难的时期，整合经济的能力不断加强，最关键的是德国已经开始尝试财政转移支付，这就尴尬了。美国方面，虽然经济不如欧盟、日本、韩国亮点多，但打爆世界经济的目的还是没有改变。芳草碧连天，萧瑟愁王孙。现在轮到中国经济到最困难的时期，大家会不会上来踩一脚？考验传说中人性的时候到了。我们复一下盘，从08年至今，中国最大的问题就是没有对美国经济进行深度捆绑。从08年至今，假如中国有十二万亿的美元储备，你人民币随便印，你搞个四百万亿都不是问题。我人民币就是这样，你美金敢和我比着印？你不敢你就输了。我有四百万亿吊着你打，美国也是无可奈何。这就是货币之锚，这就是孔祥熙战略。但问题就是当时中国有一群人，他们认为储备美元毫无意义，于是抛出美元，导致今天不能对美国经济进行深度捆绑。所以美国贸易制裁你的时候，你根本无能为力。今天你就是抛掉三万亿美元，美国动动手指就消化掉了。而你的货币失去锚以后，物价将会失去控制。有些读者说他买美元亏了，我呵呵一笑，他们还是眼皮子太浅，没有长远的目光。黄金是钱，美元是货币。美国贸易制裁中国，并不是因为意识形态，也不是因为贸易出超，就是因为中国成为世界第二。他制裁中国的终极目的就是为了打爆中国经济。中国其实现在超级尴尬，美国人的航母已经游弋在南中国海，美国的贸易制裁已经拉开序幕。对于中国而言，现在唯一的办法就是学97年人民币大幅贬值，只不过这一次要幅度更大一些，要达到30%，甚至40%。对于中国而言，失之桑榆，收之东隅。中国目前的国际环境有两个问题，一个中俄关系，一个是中印问题。关于中俄关系，中美贸易战一时半会完不了，中国还有三万亿美元可以和美国耗。中俄关系才是问题的重中之重，唐纳德为什么频繁接触俄罗斯？就是想让俄罗斯打头阵。为什么接触失败？说明俄罗斯的要价太高，美国不能接受。俄罗斯要价是什么？是巴尔干？是东北？是新疆？是西藏？根据俄罗斯人一贯的尿性，估计俄罗斯向美国人要的是外蒙古和东北。东北都不是我担心的，毕竟那里都是中国人。不是有个笑话，就是浪费了一些子弹，枪杆子还在我们手里。村长担心的是新疆。大清国最大的问题是什么？是保新疆，还是保台湾，其实今天这个问题还在。中国是陆权大国，新疆一定要在我手。还有一个就是中印问题。印度也想学俄罗斯搞中国那么一下下，只是美国人的钱不到位，印度人又不是傻叉，所以自己也觉得没意思。屁颠、屁颠走了，但印度人还是会来。你们还记得发动一二八淞沪会战的蒋介石吧？蒋介石和莫迪都是民族主义者，他们有着一样的思维模式，印度民族绝对不会永远用忍耐饥饿的办法，发展现代化，他们唯一的选择就是像当年的蒋介石一样，当一个投机商人，用世界政治的力量把东亚的霸主日本拉下位置。所以中国正确的做法的就是向印度输出意识形态，中印之间的关系其实已经很明确了。世界的资源不够中国现代化，这是常识。但印度假如不想爆发大规模的饥荒，那他唯一的选择就是拉中国下水。印度是一个傻叉国家，但你不要忘了，他是地球上另外一个可以和中国匹敌的国家。今天东南亚的局面是符合中国利益的，再去军事占领意义不大，所以向印度输出革命就是中国唯一正确的选择。还有就是中国要及时出兵占领阿富汗，还有修建中伊石油管道。保证伊朗的安全，就是保证中国战争潜力的根本所在。有些人对美国抱有幻想，认为美国会来拯救中国经济。我呵呵一笑。黎塞留和奥斯曼土耳其结盟的时候，是希望穆斯林到巴黎香榭丽舍大道强奸法国妇女？意识形态是一回事，国家利益是一回事，人类自觉是另外一回事情。我们学习地缘政治的时候，一定要懂，国家是有意识的暴力机器。美国他会不断的把你拉高到非常高的高度，然后放手叫你自由下坠，比如说民国的恶性通胀。中国和美国从来都不是朋友，当然算上俄罗斯的话，中美之间是亲美无间的盟友。讲一下中美贸易战之间可能带来的问题吧。历史上中国为什么闭关锁国？你们认为这是愚昧？这其实恰恰是中国人聪明的地方。西方有巴门尼德，我们只有焚书和坑儒，我们不是西方人的对手。我们算计不过西方人，所以游戏最好的办法就是大家脱离接触。当然今天，你们还是有选择的，或者学习巴门尼德做一个人，或者信中医得永生。假如中美贸易战争开始，五减一常，没有那一个国家可以置身事外。中国要做的就是物质代偿，尤其是向澳大利亚、南非、巴西、加拿大传到经济压力，比如说提高他们的进口关税，经济压力会传导回美国，从而诱发美国股市崩盘。
