name,type,headline,gender,created_time,vote,comment,content
蓝宝王,people,公众号：蓝宝王。美资芯片原厂高级工程师,1,2018-04-20 17:37:48,11,4,最新消息:原文:估计不会，看下图，另外一家知名台湾企业的通告截图：停止向中兴出货。由于台湾厂有很多专利或者知识产权购买自美国，可能会被美国视为间接向中兴出口产品，因此台厂可能不愿意得罪美国。
Elias Wang,people,想要在躺椅上睡午觉睡到自然醒,1,2018-04-20 18:16:19,1,0,只要用到了美国的 IP core，一样不能卖给中兴。这几天各家法务会排查自家用到的license吧。
赵一凡,people,,1,2018-04-20 14:50:15,4,0,会，但并非联发科对中兴“雪中送炭”，更不是“拔刀相助”。中兴与联发科本来就维持着一定的合作，但中兴本次受制裁的影响并非联发科提供芯片就能解决的。事实上联发科等台湾电子企业长期以来一直都是欧美日的下游厂商，其自主知识产权的芯片并不能取代以美国高通为代表的欧美同类产品，特别是高端产品。实际上联发科近年来与大陆企业的合作局限于中低端的电子产品，智能手机领域的合作方除了一些名字不重要的小型“山寨”企业之外，真正出名的只有一个魅族手机。但即使是魅族，也在2017年正式全面倒向美国高通。台湾联发科在智能手机领域的合作伙伴，一个能打的都没有。而中兴真正需求的也并非联发科这种低端企业提供的中低端产品。
编辑个人资料,people,历史、地理、天文爱好者,-1,2018-04-28 09:15:14,1,0,中兴的问题不是手机，本身它手机终端也赚不到钱，问题是在通信基站大型设备上被卡脖子，整个零部件供应链系统最核心的部分都被美国人掌控，一旦断货想靠中兴一己之力去掌握所有核心技术是不现实的，就算你最后造得出，那技术够不够先进呢？你在追赶别人也不是原地踏步的，科技行业起步晚是很难在短时间内追平的，除非中兴下定决心创造出某些颠覆性的技术出来，亦或者投资大量资金搞自研，攻克制造芯片的光刻机这些核心领域，否则想靠联发科救它是不可能的，联发科它只是供应链系统其中的一环而已。
秦旋,people,数字芯片设计工程师,1,2018-04-20 16:11:54,1,0,联发科能供的只有个soc吧，意义不大。
吴俊林,people,在中兴工作的非中兴员工,1,2018-04-19 19:50:01,0,2,中兴要的芯片联发科又没有。。
